,Unnamed: 0,joke_type,score,title,selftext,surprisal,entropy
1530,6824,0,124,What do you call a person on weed doing two tasks at once?,Killing two birds with one stoned,2.2748842,-2.8968241
1531,7140,0,12,How can you tell if your girlfriend has good credit?,If her name is Lisa Carr,-0.4943257,-0.5580835
1532,3001,0,4,"Yesterday, a clown held the door open for me.",That was such a nice jester.,1.567033,-0.78582263
1533,4050,0,1,Why did Cinderella get kicked off the basketball team?,She ran away from the ball. ,0.1691047,0.06604721
1534,2097,0,1,"Will, will, will...",If it isn’t a probate court.,0.76331633,0.5583918
1535,5123,0,267,Why is it good to have a crab as a friend?,They'll come through for you in a pinch,-0.08788429,-0.7340922
1536,6443,0,575,What's the difference between a poor man and a feather pillow?,"One is hard up, the other is soft down.",-0.3483553,-0.7918627
1537,1816,0,43,My granddad got his tongue shot off in the war...,...but he doesn't talk about it.,0.72790647,-0.7065222
1538,5418,0,1,why was the diva pony unable to sing at the opera ?,because it was a little horse,-1.4846923,1.7550299
1539,4358,0,7,Friend: I've got a candy that'll make you laugh all day!,"Me: Dude, it's a Snickers...",1.1077116,-0.7384297
1540,4551,0,20,Why can’t a pirate ever finish the alphabet ?,Because they are always stuck at C. 🐟🦑🐙,-0.8265683,0.38153103
1541,2122,0,5,Did you hear about the actor who fell through the floorboards?,He was just going through a stage.,-0.16001187,1.1807433
1542,639,0,0,What did the one wall say to the other wall?,"""Meet you at the corner""",-0.8045473,0.47465825
1543,1092,0,88,Why did the Clydesdale give the pony a glass of water?,Because he was a little horse!,-0.29108405,0.79689854
1544,4837,0,1,"""Has your dog got a name?""","""Yes,"" I replied. ""It's called a Labrador.""",0.6025838,0.45540026
1545,3885,0,326,Told my PC gamer friend that I bought a home for my rodent.,He should see my new mouse pad.,-0.9401982,1.2889043
1546,5061,0,219,Distinctly possible it is,You ever wonder if the reason Star Wars movies came out the order they came out was because Yoda was in charge of the release dates?,-0.62753457,-0.26053992
1547,5488,0,23,All of the fortune tellers I've met are either really depressing or overly enhusiastic., Why can't I find a happy medium?,0.24645048,-0.88685685
1548,2645,0,25,A communist joke is only funny if everybody laughs.,(Sorry for the repost. Last one had a typo in the title!),0.20152377,0.0138603505
1549,6470,0,360,My doctor said the X-ray was negative.,"I was like, “aren’t they all?”",2.8437471,-1.2338151
1550,2698,0,12,Why did the belt get arrested?,He held up a pair of pants.,0.27508655,0.1515076
1551,4954,0,1,What do you call a mummy with a cold?,"I don’t know, Sir Cough I guess",1.2672043,-0.92129767
1552,5746,0,8,The problem with these nosey pepper merchants is...,They’re always trying to get jalapeño business.,2.1665738,-0.6639178
1553,6684,0,82,Why did the hospital send all the nurses to art school?,So they could learn to draw blood.,0.8751829,0.44691697
1554,6923,0,224,Did you hear about the guy who through his alarm clock while hosting a party?,He wanted to see if time flys while having fun.,0.24979465,-0.28799576
1555,3802,0,1,Daughter going through coupons for shopping trip.,"I say ""Are any of those gray?"" She groans and says ""How do you live with yourself?"" I respond "" I don't, I live with your mother"".",0.6101298,-0.30062988
1556,6872,0,131,I’ve been told crocodiles can grow up to 15 feet,but I’ve never seen one with more than four.,0.78867716,-1.5266086
1557,40,0,4,"2 fish in a tank, one says to the other",Do you know how to drive this thing?,-0.14257216,-0.780363
1558,2786,0,3,There's no use crying over spilt milk...,...unless the milk was spilt on your father's fresh corpse right before his funeral.,0.7933998,0.5998365
1559,6792,0,226,Mom cat loved to tell stories as she tussled around with her kittens.,"They got caught up in her twisted web of fantasies as she strung them along, spinning yarns about days gone by.",-0.28488258,-0.35291883
1560,5946,0,4,My wife and I stopped talking for days after blaming each other for not defrosting the refrigerator.,"Finally, I had to break the ice.",-0.16110507,-0.8414912
1561,2387,0,34,What's the difference between a democratic system and a feudal system?,"In one your vote counts, in the other, your count votes.",-0.91303396,-1.0951434
1562,406,0,36,Have you been injured in a car accident?,call 555-bottom-feeders.  We will do anything for money.,-0.51839703,-0.49045986
1563,4403,0,14,I'm glad I'm good at making musical puns,Otherwise I'd have some pretty dim innuendos.,1.2919403,-0.6538711
1564,6821,0,16,I collect ginger and the other Asian spices.,I guess I have a wasabi hobby,0.21770363,0.49106118
1565,2386,0,79,Why did the man break into song?,He couldn't find the right key.,0.24889688,0.08494784
1566,5142,0,14,Schrodinger's Crush," Before you ask her out, she is both single and taken",-1.7179651,0.9502457
1567,561,0,23,A chemistry teacher asked a student if they know anything about Sodium...,"The student replies ""Na"" :)",-0.6283887,0.14572006
1568,5708,0,25,A man showed up for a duel armed only with a pencil and paper., He then proceeded to draw his weapon.,0.027994791,-0.11263873
1569,4161,0,619,I asked Ryu if i could learn martial arts at his level yesterday,He said: “Suuuuureee YOU can!”,-0.6767416,0.38007283
1570,3660,0,6,If you stand by the sea...,...it sounds like putting a shell to your ear.,-0.51640695,0.59436214
1571,865,0,12,A big thanks to all the sidewalks out there..,They've been keeping me off the streets for as long as I can remember!,0.7672756,-1.4713361
1572,3833,0,1,Why does the writer have his desk by the window?,He likes to feel the draft coming in. ,-0.26236337,0.5553956
1573,6766,0,355,how did the farmer sell his corn before picking it?,Corn stalks were up 📈,2.028883,-0.43675247
1574,6755,0,2,I've developed an overwhelming fear that I'll have to drive underground to pick up the kids at their school.,Just diagnosed with Carpool Tunnel Syndrome,0.5396948,0.019320343
1575,447,0,0,"Did someone say ""purple""?","Sorry, it must have been a pigment of my imagination!",-0.47609642,-0.19300163
1576,7294,0,111,"Monday, Tuesday, Wednesday,Thursday, Friday, Saturday, Sunday",Arrr those where the day's.,-2.8175683,3.248345
1577,6059,0,77,"I don't get it, I've just lost my job window cleaning the local Church..",.. despite removing all the stains.,-1.2682015,2.1436398
1578,7387,0,10,"A father was washing his car with his son and the son asked,","“Dad, can’t you just use a sponge?”",1.2405775,-0.7412406
1579,5790,0,38,"I had an appointment to see my Psychic next week, but She's just after ringing me up to say..",..that I won't be able to make it.,0.20318581,-1.5304096
1580,3107,0,2,What’s green and has wheels?,Grass. I lied about the wheels.,-0.43129882,1.1349425
1581,5062,0,41,Research found chewing of garlic cloves daily helps prevent Wuhan virus.,People around you will socially distance from you automatically.,-0.1382709,-0.772787
1582,1007,0,1,Why was the tomato blushing?,Because it saw the salad dressing!,-0.8254533,1.939393
1583,6091,0,5,Why did the drunkard put his alcohol in an elevator?,He was trying to raise his spirits.,1.1167119,-0.039339975
1584,6068,0,11,A Board Game Walks into a Bar...," The bartender says, ""look, we don't want any Trouble!""",0.1162368,0.1409042
1585,4550,0,2,I always get confused between bowling and baseball...,"But, to be fair, they have striking similarities",-0.28867692,-0.9223859
1586,1162,0,32,I went to the doctors today and told him I keep getting coffee dripping out of my ear…,He said I've got a percolated eardrum.,2.568358,-0.8607979
1587,3965,0,30,The wife laughed when I told her I was building a car out of spaghetti...,You should have seen her face when I drove pasta!,0.5707903,-0.784632
1588,1747,0,12,What did the Buddhist ask the hot dog vendor?,“Make me one with everything.”,1.7544088,0.28580642
1589,6174,0,280,A man sitting at the bar nursing a cocktail keeps hearing,"a whispering voice saying things like nice watch, nice haircut, nice suit ... after a while he inquires of the barkeep who says oh that’s the peanuts. They’re complimentary.",0.2703892,-0.2720362
1590,1376,0,87,What Is The Worst Part About Time Traveling Jokes?,You already know the punchline.,0.1770956,-1.1451612
1591,1236,0,21,Cheap shoes...,...are a woman's arch enemy.,0.19647743,0.64344454
1592,1062,0,71,I just spent a whole hour writing with a broken pencil...,...before I realized that it was pointless...,-0.027179036,0.20099461
1593,2446,0,5,I watch so much Netflix that rather than suggesting more shows for me to watch...,...it’s started suggesting I go outside.,0.8784878,-0.32559422
1594,4590,0,37,"A komodo dragon works security cameras at a store for other komodo dragons. Mostly, he makes sure no other dragon is spying on the customers…",He's a monitor monitor monitoring a monitor for monitoring monitors.,-2.933701,0.41777062
1595,3874,0,36,I have the body of a Greek god!,"Buddha was a Greek god, right?",-1.5830916,0.3509193
1596,6797,0,188,I tried to come up with a Labor Day joke but it didn't work.,I guess it was because I was preoccupied.,1.0748955,-0.42064214
1597,5375,0,25,why can't the number 4 get to sleep at night ?,because it's 2 squared of the dark,-2.0591657,1.5631696
1598,7167,0,60,What’s the difference between black eyed peas and chickpeas?,"Black eyed peas can sing us a song, chickpeas can only hummus one.",0.8522284,-1.0865053
1599,720,0,11,Accidental Seafood,I tried dolphin once...but not on porpoise. ,0.28182372,0.5194291
1600,7298,0,3,I used to be addicted to the Hokey Pokey.,"But, i turned myself around.",-0.057456195,0.03381865
1601,2928,0,46,I've read of crimes in multi-stories buildings.,That's wrong on so many levels.,0.901705,-2.1199405
1602,3165,0,11,"I was chatting to a girl yesterday and I told her I was thinking of running a marathon again. She was impressed, “You’ve run a marathon before?”","I said, “No, but I’ve thought about it.”",1.3375136,-1.7719777
1603,6911,0,6,Doctors tell us there are over seven million people who are overweight.,"These, of course, are only round figures.",1.0739218,-1.6897871
1604,1087,0,0,Did you hear about the sheep who robbed the bank?,The police couldn't catch him because he was on the lamb. ,0.17772989,-0.33352414
1605,3917,0,0,"After being single for years, I finally found the perfect match online.",It produces a greenish flame and it looks really cool while I'm lighting up my cigarette.,-0.57323754,0.5389187
1606,3322,0,0,If you're attacked by a group of clowns...,Just go for the juggler.,0.4905296,0.064315945
1607,994,0,30,"X-post from r/jokes: ""Hey! The dog you sold me yesterday just fell over and died today!""","""Huh, strange. He's never done that before.""",-0.27900043,-0.29077372
1608,6453,0,502,What's the difference between a homeless person and a cook in a convent?,One needs funds and the other feeds nuns.,0.4580486,-0.7870907
1609,2912,0,1,I invented a cold air balloon.,"Though, it never really took off.",0.44536558,-0.9314002
1610,755,0,54,How do you make a computer your best friend?,You buy it a nice bunch of software and get it loaded!,-0.2939187,0.1402313
1611,3026,0,29,Children seldom misquote you.,"In fact, they usually repeat word for word what you shouldn't have said.",0.9988505,-1.9786614
1612,4131,0,19,"The guys who wrote the song ""Maneater"" started a horse-feed delivery service.","They called it ""Haulin' Oats.""",0.40842888,-0.1688637
1613,1350,0,53,Man didn't you hear about the orange that got fired from the orange juice factory?,"He got fired, terrible... They found out he couldn't concentrate.",0.2145549,0.25959668
1614,7378,0,45,A study found that farmers who talk to their cows get better milk.,In one ear and out the udder.,0.17033313,-2.1342888
1615,6832,0,65,Gay Couple Asked Me for Directions..,I told them to go straight.,-1.5664048,0.012730047
1616,2550,0,132,Why do plastic surgeons like nose jobs so much?,They love to pick people’s noses. ,1.826683,-0.22131437
1617,2349,0,54,Rosh Hashana is coming along just fine.,"When the rabbi start to toot his own horn, i thought he would blow it. But he did a good job: Shofar, so good.",-0.5848806,0.70511407
1618,4850,0,642,TIL Humans eat more bananas than monkeys.,## I can't remember the last time I ate a monkey.,-0.9855158,0.1295998
1619,3221,0,6,I had a pun about insanity...,...but then I lost it...,-0.37988356,0.60241985
1620,6016,0,407,What’s worst than to find a worm in an apple?,To find half a worm,0.97799426,-1.7756238
1621,3628,0,15,My buddy called me and asked what I was doing...,"I replied, ""Probably failing my driving test.""",0.305526,0.1821111
1622,7277,0,75,"Just by looking, i can tell if someone is lying.",I can also tell if they are standing.,-0.8456674,-0.38454917
1623,7362,0,0,I don’t play soccer because I enjoy the sport.,I’m just doing it for kicks.,1.23911,-1.8212522
1624,6961,0,12,My friend Phillip had his lip removed last week,now we just call him Phil,-1.3714193,0.07027342
1625,527,0,70,Why did everyone trust the marsupial?,Everything he said was troo,-0.20785438,-0.2084459
1626,5990,0,623,"For 2021, I'm absolutely done with being a people pleaser..",..if everyone is ok with that ?,-0.861138,0.28820682
1627,6273,0,341,A man took a bullet to the face in a shooting last week. If anyone has any information please call city police.,The only thing they have to go on is the mug shot.,-0.21348788,-0.81940424
1628,5753,0,1,"The other day, my Dad asked me why I chose to take up window cleaning as a profession. So l told him..",.. that it was the only job I could really see myself doing.,-0.9044585,-0.8482395
1629,6799,0,12,I called the ASPCA hotline to tell them I'd just found six Badgers in a suitcase by the side of the Road," ""Are they moving?"" asked the operator ""Not sure"" I replied ""But that would explain the suitcase""",0.37165272,-0.08097687
1630,5072,0,1,I bought my friends an elephant for their room. They said: “Thank you.”,I said: “Please don’t mention it.”,2.5463002,-1.6085938
1631,4166,0,1,I used to be much better at grammar before my colostomy.,At least I'm still using my semi-colon correctly.,0.42467594,-0.04131929
1632,312,0,19,Request: Jokes for the sick?,"I have a good friend who was just hospitalized, hopefully nothing too serious. I'd love to send him a few short, clean jokes to cheer him up. Thanks!",-0.44680426,-0.55197865
1633,7419,0,35,After dinner my mother asked me to clear the table,"It took me a running start, but I did it.",-0.054992355,-1.0033209
1634,1603,0,27,"I went to a pet shop and put a sign saying, 'Chameleon'…",…next to an empty cage…,-0.86055434,0.79708356
1635,4270,0,7,I met a cow who really didn't want to pay,I guess you could call him a cheap-steak.,0.51622283,0.15232955
1636,7129,0,48,"Recently, i decided to take up fencing.",The neighbors said they will call the police unless i put it back.,-0.024018096,-0.34158668
1637,2303,0,1,Want to hear a construction joke?,I'm still working on it.,0.14526546,-0.42027998
1638,7123,0,145,I went to the doctor to cure my invisibility.,But they weren't able to see me. :(,2.187176,-1.0375922
1639,1947,0,16,"When I was a child, my family was so poor...","...that at Christmas, we exchanged glances.",-0.20082143,-0.21637619
1640,6960,0,1,My friend Phillip has his lip removed last week, now we just call him Phil,-1.8767546,0.14067943
1641,4500,0,7,I just spotted an albino dalmatian...,It was the least I could do!,0.2752174,-0.54290473
1642,4580,0,483,(Star war joke) From where did Aniken skywalker get his robotic hand?,From the second HAND shop,-0.1894375,3.6587152
1643,7347,0,31,What's the difference between an etymologist and an entomologist?,The etymologist knows the difference.,3.8743737,-1.6838849
1644,2146,0,19,I saw a smart Broadway show about the first dictionary.,It was a clever play on words.,0.29072285,0.10987927
1645,1438,0,30,I accidentally walked into my son in the shower.,"Well that's a clean joke, right?",-0.65249145,-0.06637989
1646,490,0,76,Why did the raisin take the prune to the new year's ball?,Because he couldn't find a date!,0.3477402,0.24468552
1647,4557,0,9,I just slipped on a banana skin.,I look ridiculous in it.,0.03893376,0.07855112
1648,2694,0,62,Did you hear about the race between the lettuce and the tomato?,The lettuce was ahead and the tomato was trying to ketchup.,0.0033842926,-0.6162319
1649,2686,0,21,"After the contractor dug the hole, Bob got angry and filled it with water.","To get the whole story, you must realize he meant well.",0.2831359,-0.258035
1650,2335,0,142,"My girlfriend broke up with me because I’m a compulsive gambler and ever since, all I can think about...",...is how to win her back.,-0.9500117,-0.6091061
1651,4007,0,111,What did the fisherman say to the magician?,"Pick a Cod, any Cod",-1.3934116,1.4731818
1652,2524,0,11,I'm seriously thinking about re-marrying my ex-wife.,But I'm pretty sure she'll figure out I'm just after my money.,0.81422204,-0.13635318
1653,4655,0,0,To the guy who stole my trainers and high-vis jacket...,...you can run but you can't hide!,0.5717936,-1.3479251
1654,4103,0,1,I know of a bald guy that got a comb for his birthday.,He said he could never part with it. ,0.24676195,-0.89038515
1655,7059,0,247,The rooster tried to pass himself off as a hen..,.. but he didn't have an egg to stand on.,-0.5103843,-0.27990034
1656,787,0,92,Why was the burrito embarrassed?,It saw the salad dressing. ,-0.54675126,1.731725
1657,1018,0,1,My dog used to chase people on a bike a lot.,"It got so bad, finally I had to take his bike away.",-0.8125687,-0.7717797
1658,4188,0,0,An owl babysat my son so I could go to the hoedown.,It was a hootin' nanny.,0.784293,0.11648567
1659,4110,0,11,Tell the Punchline first.,How do you ruin a joke?,0.31469646,0.015293873
1660,4459,0,644,Gonna sell custom made coffins,Slogan: Guaranteed to last a lifetime,1.7545215,0.7264771
1661,913,0,18,Wanna hear a dirty joke?,Two white stallions fell in the mud.,0.37438443,-0.15797181
1662,150,0,47,I was wondering why the frisbee was getting bigger.,And then it hit me.,-0.10393503,-1.1769333
1663,2178,0,155,Why do abcdefghijklmopqrstuvwxy &amp; z hate hanging out with the letter n?,Because n always has to be the center of attention. ,-0.7934478,1.0906041
1664,5492,0,16,Two books meet up in a Library. One says ' You don't look too well at all. ' The other one replies..,.. Just had my Appendix removed.,-0.797223,1.4532317
1665,6427,0,1,"Walked into a shop and saw a sign that ""More amazing offers upstairs!""",Interesting technique: admitting that the top floor is better.,-0.57827866,1.0763634
1666,2206,0,42,Cleaning mirrors...,...is a job I could really see myself doing.,-0.49183047,0.023681553
1667,6434,0,330,Did you know you can't run through a campground?,"You can only ran, because it's past tents",-0.24059711,-0.0021907124
1668,2350,0,69,My doctor told me to cut down on sodium.,I took his advice with a pinch of salt.,0.8576359,-1.8315758
1669,4855,0,5,My astrology teacher asked me about my horoscope.,"I said, ""I'm not too fussy as long as it doesn't have ghosts in.""",1.4263271,-1.7802043
1670,4595,0,17,A house goes to the doctor complaining about its windows.,"When the doctor asks what the problem is, the house replies, ""I have panes all over.""",0.33978158,-1.4321243
1671,4719,0,363,In order to improve higher education...,We must build taller schools,1.1746968,0.5786355
1672,1556,0,38,What do you call Mexican midgets?,"A paragraph, because they're too short to be an essay.",-0.84767675,1.2950927
1673,950,0,82,I think I want a job cleaning mirrors...,...it's just something I can see myself doing.,-0.27437723,-0.70422596
1674,5171,0,607,Went to a theater and my dumb friends wouldn’t sit together.,We ended up getting into a row.,0.54031944,-0.5978044
1675,4656,0,164,Why did the tomato blush?,Because it saw the salad dressing!,-0.8288716,1.9630866
1676,3882,0,1,A man walks into a library and asks for a book about lubricants.,The librarian points him towards the non-friction section.,1.8211647,-0.6237788
1677,7241,0,151,She was only a whiskey-maker's daughter,but he loved her still.,-0.84591174,0.24530292
1678,2496,0,16,Sleeping is so easy.,I can do it with my eyes closed.,-0.30540732,-0.38971487
1679,793,0,38,was going to make a joke about science,but I know for I wont get a reaction...,-0.029055709,0.3585635
1680,151,0,37,I thought I had a brain tumor,but then I realized it was all in my head.,0.038974766,-1.2770078
1681,313,0,44,Two peanuts were walking down the street....,And one of them was assaulted,-0.18776847,0.5398335
1682,6670,0,32,What’s the difference between a hippo and a Zippo?,One is heavy and the other is a little lighter.,-0.35827348,-0.9704702
1683,4972,0,69,I wanted a tattoo of the number 3.14 on my arm...,But my wife said that was irrational.,-0.14485365,0.4324509
1684,3980,0,2,I spent a summer working on a rabbit farm...,It was a hare raising experience...,-0.50117195,0.3468171
1685,5910,0,29,Did you know louisiana was settled by a Mexican man and his wife??,Their names were Luis y Ana,-0.44486827,1.8502256
1686,5291,0,1,What’s with these stingy ducks,They can’t get rid of their bills,2.012245,-0.5334258
1687,4339,0,79,I hold the Guinness World Record for longest time without brushing my teeth.,I've got the plaque to prove it.,0.602822,-0.6141344
1688,7278,0,114,Pushed my grandma into a pile of leaves,I said have a nice fall,-0.58023995,-1.04826
1689,1783,0,116,I once bought some used paint.,It was in the shape of a house.﻿,-0.30746022,-0.11039285
1690,5841,0,4,I'm working on a fitness routine for insects.," It's going well, but I'm still trying to work out the bugs.",-0.23912264,-1.1705449
1691,6721,0,6,Visited my doctor today. He told me my sugar was too high.,So I came home and moved it to a lower shelf.,-0.22725625,-0.29646534
1692,4553,0,14,"New British Prime Minister, Boris Johnson",held a meeting with the cabinet today. He also spoke to the bookcase and argued with the chest of drawers.,0.30479485,-0.3189515
1693,4305,0,456,The vote for better slides in school playgrounds is on the ballot this year.,"Unfortunately, I live in a swing state.",-0.10006042,-0.81520677
1694,5717,0,22,What is a pirates favorite letter?,"You'd think it was ""R,"" but it is really the ""C.""",-0.25833347,-0.29411975
1695,4192,0,0,Someone tried to sell me a burial plot today,That's the last thing I need!,0.26791313,0.12228931
1696,136,0,47,What did the pony say when he had a sore throat?,"Pardon me, I'm just a little hoarse.  ",-0.54196495,0.17249341
1697,280,0,0,Why did Shaggy 2 dope go to the Dentist?,He needed some insane crown flossing. ,0.6646344,0.9811123
1698,1833,0,20,When the cigarette lighter salesman tried to win back his old flame...,...he found that he had met his match.,-0.42994213,-0.02710741
1699,6131,0,19,"Do you ever feel bored on reddit, because you read everything already?", I guess you could say you've reddit already,-0.45830336,0.097670004
1700,4343,0,7,Most people don't like Oysters because they give people bad breath.,I don't like Oysters because they make my hands really clammy.,1.5539486,-1.4840329
1701,2764,0,19,Why did the girl bring lipstick and eye shadow to school?,She had a make-up exam.,0.59592164,-0.14319907
1702,7102,0,1,I thought about making some tea,But then I decided the time cost was to steep,-0.59500206,-0.37783587
1703,6121,0,619,Why did the baker's hands smell?,Because he kneaded a poo,2.24984,-1.3503971
1704,2631,0,60,I set out to lose 10 pounds this month...,Only 15 more to go.,0.8391187,-0.7849798
1705,2193,0,37,Why did the Cowboy buy a dachshund dog?,He wanted to 'get a loooooooong little doggy' ,-0.26388496,0.81763935
1706,486,0,11,Why did the vegetable band break up?,They couldn't keep a beet.,0.9777962,-0.10352092
1707,5624,0,747,"Old mathematicians never die,", They just lose some of their functions.,-0.07642534,0.3921646
1708,946,0,43,I would make a sparrow joke...,But they don't fly very well.,0.34096378,-0.46454376
1709,5480,0,1,Knock Knock, Knock! Knock! -Who’s there? Hanna. -Hanna who? Hanna partridge in a pear tree,0.13267578,-1.2413644
1710,1362,0,48,Can a kangaroo jump higher than the Empire State Building?,Of course. The Empire State Building can't jump. ,0.98743343,-1.0876075
1711,4122,0,437,"If you put a picture of yourself in a locket,",you could say you are... Independant,0.8106362,0.6756641
1712,6193,0,1,I'd tell you a great time travel joke..., but you didn't like it..,-0.16220263,-1.0874557
1713,2322,0,8,A mother took her child to the doctor fearing he had swallowed some coins.,"When nothing worked, the doctor told the mother there was no change in his condition.",1.0820148,-1.7222545
1714,1514,0,6,Just spent ages waxing the car...,Still not sure how it gets that hairy...,-0.21757886,1.3355945
1715,7443,0,380,Do you know sign language?,"You should learn it, it’s pretty handy.",0.56259525,-0.7482273
1716,3737,0,1,What did one mushroom say to his mushroom friend when he didn’t want to go out?,"Hey man, I thought you were a fun guy (funghi)! ",-0.8495447,1.0105448
1717,4095,0,6,Why did Jim Morrison cross the road?,To break on through to the other side ,-0.5588009,-0.3025225
1718,5875,0,510,"If 2020 is not bad enough already, I've just read about Dentists planning a national strike next month..",.. we'll just have to brace ourselves so.,-0.508081,-0.9255171
1719,4649,0,30,Someone keeps leaving celery on my doorstep...,I think I'm being stakled!,1.2352912,0.23061411
1720,2198,0,30,I'm not sure I believe all this stuff about genetically modified food being bad for you...,I just had a really tasty leg of salmon and I feel fine...,-1.273322,0.18258084
