,Unnamed: 0,joke_type,score,title,selftext,surprisal,entropy
4189,47418,1,87,"We need to do something about the ""deputy moderator""situation...",We should be able to take down posts with 1 report too,-0.23108812,0.9767967
4190,74369,1,1,Why’d Optimus Prime and 5 more bots got arrested?,They got a Ford escort and voided it’s power train warranty,0.38984364,0.21268001
4191,23227,1,10,Why are black people against needles,Every time they see the cotton swab they know it’s another trip back to the fields,0.43479306,0.32909817
4192,29938,1,4,"Hear about the racist, young white man who shot 9 brown people?",I hear the Army gave him the Silver Star! GOD BLESS OUR TROOPS,0.8906413,-0.6247162
4193,82903,1,13,Did you guys know black people weren't aloud on the Titanic?,I guess you could say you lose some and win some,0.35714278,-0.25398663
4194,49123,1,23,A women walks into a bar,The Automod locks the door and rapes her,0.26774648,0.8164683
4195,49720,1,15,I never understood school shooting jokes....,I guess there just aimed for a younger audiences,-0.80393916,-0.38579974
4196,55576,1,4,What's the difference between Jews and cookies,Cookies come out of the oven,0.04910147,-1.9163903
4197,57560,1,11,If you have this post locked....,You will get fucked in the ass by a Porcupine tonight,0.15794587,-0.12355392
4198,81058,1,1,What’s the difference between COVID-19 and Hitler?,Only one of them was good at killing children.,0.049978297,0.15124789
4199,23061,1,3,I painted my router black thinking it would be faster,Now I just keep losing my packets.,-0.40162367,1.4020231
4200,76906,1,29,How do you fit 15 jews in a car ?,"2 in the front, 3 in the back and 10 in the ashtray",-1.160616,-1.7140763
4201,67495,1,36,Why don't black people celebrate Christmas?,Because there are no chimneys in jail.,1.380869,-0.69009495
4202,63637,1,21,My friend gave me his Epi-Pen while he was dying.,It seemed really important to him that I have it.,0.23384424,-0.924174
4203,27955,1,54,What’s the difference between a 4 year old and a bowling ball?,A bowling ball won’t cry when I ram 3 fingers in it then leave it down an alley.,-0.40798655,-0.89661604
4204,37729,1,4,For all the men who think a woman's place is in the kitchen..........,remember that's where the knives are kept,-1.1038046,0.7633903
4205,82327,1,5,What's the similarity between Micheal Jackson and a PS4?,A kid can turn them on.,-1.2127581,0.7787685
4206,72876,1,0,Wait... what...?,Nothing's funnier than a pedo laughing at pedo jokes,1.0235133,-0.24480851
4207,43805,1,6,What's the difference between a Necrophiliac and a pedophile?,The temperature of the baby.,-0.99709773,0.79575145
4208,70651,1,7,Playing as Kobe on NBA 2K20 today.,Tried the helicopter dunk but the game crashed...,-0.5027904,1.4825017
4209,14127,1,155,Whats the best part of when all your relatives die?,You can finally suicide without anyone getting affected :),0.06838906,0.7537284
4210,68038,1,30,"Making automod do absolute stupid shit isn’t funny or edgy, just absolutely ridiculous.","And then i said, “thats not an elephant, thats my wife.”",0.01717535,0.6677311
4211,75970,1,92,Why aren’t black people in the Olympics,Because running away from the police isn’t a sport,0.3696827,-0.49882495
4212,15449,1,188,What do you do when a woman gets hit by a car?,Wonder what the car was doing in the kitchen.,-1.1422908,-0.20525578
4213,26756,1,49,People are like jellybeans.,Everyone hates the black ones.,1.6129919,-0.3152022
4214,80691,1,1,"It's a bird, it's a plane",Flying into the twin towers,-1.3923123,1.6532588
4215,76221,1,1,I took my girlfriend bungee jumping.," As her body hit and spread out over the rocks below, I thought, ""That'll teach you to lie about your weight.""",-0.542279,-0.22483549
4216,46228,1,2,Why does Massachusetts support the mods?,They just banned Gay Conversion Therapy.,-0.5048398,0.32160747
4217,55102,1,24,What does McDonalds and a priest have in common?,They both put their meat in kids.,-0.13020845,0.0064799725
4218,86020,1,4,What's the difference between a peaceable assembly and a riot?,Say anything and the answer will be in the first two c*mments.,-0.59217876,0.35499305
4219,43946,1,0,"Now that Michael Jackson is dead, why bother with rebuttals of Leaving Neverland?",Since Michael Jackson did enough rebutting of those boys when he was alive.,0.811575,-1.1077076
4220,68247,1,4479,Walked by the cancer ward in a hospital yesterday and saw a 5 year old crying,He wasn't handling his mid-life crisis very well,1.2123219,-0.796351
4221,18620,1,6,How do you know your sister’s on her period?,Your dad’s dick tastes funny,2.0396624,-0.6244428
4222,53214,1,3,What's the difference between punching a white person and a black person?,One gets U charged with assault the other impersonating a police officer.,1.0543201,-1.6376867
4223,48429,1,713,Don't be racist:,racism is a crime and crime is for black people,-0.23653667,0.108602665
4224,59392,1,1,I like my wine like I like my women,12 years old imported from Mexico and locked in my basement,-1.4852865,0.26234552
4225,38840,1,26,Women are like sending machines,When you pay them for a favor sometimes you may have to beat them to get it out ,-0.35902467,-0.5753022
4226,32505,1,7,I don’t understand why Native Americans are bitching about how their “education is substandard.”,"I mean, they’ve practically got a Reservation at Harvard,",0.772294,0.04474446
4227,38450,1,1,My girlfriend said its impossible to severely injure yourself while masterbating...,So I managed to pull it off.,-0.084466845,-0.19492544
4228,41725,1,45,"""Remember kids, Always wear your seatbelts!!""","Except for you son, you don't need a seat belt for this ride😉",-0.2400998,-0.6178854
4229,62509,1,0,I was gonna tell a joke about dead babies,But I decided to abort,0.2541631,0.33936274
4230,82915,1,5350,Jews ordered pizza...,Delivery guy arrived. But couldn't prove that he is The pizza delivery Guy. Poor guy got crucified.,-0.02772869,0.38856366
4231,81238,1,20,What do you do when someone is having a seizure in a bathtub?,Throw in some of your laundry.,-0.6442196,0.42234188
4232,63295,1,64,How is a shovel and my ex girlfriend different?,"You do not bury the shovel, you use it",-0.7926652,0.3007289
4233,46705,1,6,What is common between a good joke and yiur girlfriend,"Both can be complimented as ""Lmao dead""",-0.05067191,0.12126316
4234,30218,1,1,What's the difference between cops and the Automod?,Both get triggered by blacks.,0.758947,1.1693909
4235,70902,1,27,What does a pregnant 14-year-old and the fetus inside of her have in common?,"They're both thinking: ""Oh shit, my mum's gonna kill me!""",0.66543704,-0.29261976
4236,17234,1,92,What is the similarity between 6yo Girls and Niggers ?,Dead one is the best one .,-2.0989075,2.9896996
4237,51341,1,1,How long does it take before a baby explodes in a microwave?,It's an honest question. I've never been able to stop jerking off before I check.,0.71881974,-0.4733943
4238,57768,1,56,Mindblown,Putting a baby over the fire will likely cause the baby to be cooked,-1.0945652,1.5315725
4239,26486,1,1,There's one thing that school shooting jokes and school shotting victims have in common...,And that is that they never get old.,-0.3385645,-0.9132979
4240,62749,1,15,Why did the chicken cross the road?,To get to the *other side*!,-0.15371005,0.424917
4241,16230,1,2,School shootings are difficult.,Once the lights go out I can't find the black ones.,0.23124254,0.09661919
4242,32338,1,52,I stopped a girl from getting raped yesterday,I decided to stop chasing her,-0.73954165,0.06406344
4243,18054,1,305,"A pedophile and a child are walking through a mall late at night, the child turns to the pedophile and says “hey mister I’m afraid”",The pedophile turns and replies “ you’re afraid? I have to walk home by myself later” ,1.540381,-0.9233685
4244,75046,1,65,Study says 25% of British toddlers know how to use an iPad..,and 100% of Chinese toddlers know how to make one.,0.17444767,-1.2516804
4245,83970,1,111,what do you do after raping a deaf 12yo?,break her fingers so she doesn't snitch...lol,1.2143031,-0.42048728
4246,41294,1,0,What's a similarity between a black guy and a bike?,They both are used to having chains on them,-0.15893263,0.6735917
4247,18562,1,14,Why Africans are so good at stealing food?,The bad ones died from starvation.,0.3996135,0.5027891
4248,14560,1,1,The Namāz started,and everybody started panicking and running around,0.5988043,0.49227098
4249,29427,1,2,If I had a nickel for every gender,"I would have one nickel. Because women are objects, not a gender.",-0.55113626,0.19246611
4250,14636,1,44,Why are Black people typically more skinny than White people in America?,You need to walk to get your welfare check,0.2489466,-0.11749639
4251,31607,1,233,Bl*ck,As in suck my Big Block Dick automod,-2.0212157,2.172901
4252,78813,1,34,George Floyd really needs to lay off the cigarettes,No wonder he can't breathe,-0.8944889,0.56215173
4253,41326,1,68,Whats the upside to animal abuse from an Asian's point of view?,The meat has already been tenderized,-0.9629669,0.3502899
4254,9421,1,53,How do you get a Jewish girls number?,You roll up her sleeve,-0.64805496,0.88143593
4255,36216,1,6,What's similar between a plane and a computer?,"When it crashes, it's usually the Russians that get the blame",0.35481766,-0.5676196
4256,57717,1,5565,Why did the toddler the street?,To force me to wash my car... That little brat.,0.25066885,0.6388469
4257,33221,1,1,How do you get 11 million followers?,Run through Africa with a bottle of water. ,-0.73410535,0.92230844
4258,50647,1,5,What the fuck happened to this subreddit?,Who in their right mind thought giving everyone admin powers would be a good idea?,0.88979673,-1.856973
4259,84067,1,15,Why do children brush there teeth before bed?,Because no one enjoys tasting there own cum when kissing them goodnight.,0.60800356,-0.26778874
4260,65773,1,6,Whats the difference between me and the priest?,I wouldn't do anybody less than a 7,0.06421868,0.008899213
4261,35938,1,2,Parrots are the only animal you can have sex with,With any other animal it’s rape,1.1684726,-0.8202104
4262,60031,1,14,I am doing further studies on African-American history,"Or as I would like to call it ""niggerolgy"".",-0.4850985,-0.38858867
4263,22277,1,24,Why was the leper hockey game cancelled?,There was a face off in the corner.,0.027624866,-0.0013725358
4264,86557,1,76,Who says the US doesn't have free healthcare?,They got shot in you at school for free.,-0.37726268,0.097134486
4265,56596,1,2,I like my lamp the way I like babies,Hanging from the ceiling with a lightbulb inside it.,-0.3709443,1.3594388
4266,14574,1,6,I don't need pick up lines...,Because they don't work on corpses.,1.5556185,-0.9983492
4267,72914,1,23,Why was 6 afraid of 7 (don't worry it's not because 789),Because 7 was a 6 afender,-1.01127,1.6078945
4268,37113,1,2,What’s the similarity between a pregnant 14 year old and the foetus inside her?,"They’re both thinking, “Oh shit. My mom’s gonna kill me.”",1.9559039,-0.82417005
4269,11400,1,11,My wife walked in on me having sex with my daughter,I don't know if she was more suprised I was having sex with our daughter or that the abortion clinic gave me the fetus,-0.109772705,-0.7415613
4270,33469,1,83,What do u/N8theGr8 and Abraham Lincoln have in common?,They're both great people who had good impacts on history. ,-0.1739207,0.090261534
4271,51477,1,14,Ever notice how the word ‘limp’ is in the Special Olympics?,Except it’s spelled wrong. Which makes it even more appropriate.,1.1197375,-0.5162071
4272,59263,1,0,Why was the musician arrested?,For toying with A minor,0.94271785,1.3965151
4273,86643,1,2,Enemy,My enemy hired assassin came home and killed me ... 3 days later I am alive again I remembered that he killed my twin brother ...,-1.430993,0.622839
4274,71731,1,50,What is the difference between a skirt and a high weight object?,Everyone would cheer you for lifting a high weight object.,-0.36163944,-0.5885201
4275,18469,1,4,How do I watch child porn without Tor Browser ?,Why do I need internet to watch something happening in my room.,-0.36259654,-0.8476087
4276,10622,1,13,Whats the favorite lotion of black people.,A barrel of black oil.,-1.8735108,1.9672481
4277,73858,1,2,A leaf and an emo kid fall off a tree. Which one hits the ground first?,The leaf. The rope stopped the kid,-0.6243614,0.53050256
4278,34667,1,1,Whats the difference between a minion and a small child?,A minion actually enjoys putting my banana in it's mouth,-0.69483566,0.14314185
4279,25263,1,32,Do u know whats funny?,A vegan vet realizing that they gotta put animals down.,-1.45818,1.8481548
4280,54881,1,0,why did the boy drop his ice cream,he was hit by a bus,-0.6389438,-0.9682199
4281,41352,1,29,I dropped my sister once and I feel awful to this day,"In my defense, the coffin was heavy.",-0.26116985,1.2163168
4282,50175,1,1,Daddy and mommy got a divorce,"Now my uncle whose a mod on this sub takes care of me, but sometimes at night I wake up and he is touching me.",-0.9654351,0.38849443
4283,42997,1,1,I’m not racist because racism is a crime,And crime is for black people,-0.9728013,0.1706145
4284,60447,1,25,What Icarly would've been called if carly was black,Vinegar with out the v,-1.1531103,3.2877324
4285,23247,1,127,What would you say during a funeral that you'd also say during gang rape?,We wish you were alive.,0.59194934,0.021072159
4286,56514,1,1,A black man walks into a bar,"There is no joke, I just want to experience being able commenting on this sub before I get downvoted into oblivion",0.3344447,-0.3496523
4287,46220,1,1,What's similar to a dying kid?,This sub dying because of the Automod locking every post,-0.29297468,2.0604901
4288,31459,1,9,Whats hitlers favorite meal?,Backed jews with some mustard gas,-2.0724435,1.9334822
4289,79242,1,1,I cried when my dad chopped onions,Onions was a good dog,0.049177375,2.2089336
4290,11817,1,8,I made a Chinese Nazi Facebook page...,It already has three Reich's!,-0.7045497,0.3976047
4291,42348,1,133,What do Wall-E and black people have in common?,They both care deeply about weed.,-0.520155,-0.88468397
4292,27759,1,0,Went for a drive today,Forgot how many speed bumps there are in Bangladesh,-0.1635279,-0.15730096
4293,59747,1,2,Ok don't downvoted my comment,Im going to see if you can still !lock posts on this sub if so mods please remove it,-1.5414175,0.9936303
4294,19747,1,0,What's the difference between a pimple and a priest?,The pimple doesn't come on kids till they're 12,1.6087264,-1.1231146
4295,53624,1,36,"My friend named his dog 5 miles, so he could tell people he had walked 5 miles today.",He acted really surprised when I told him that I had ran over 5 miles today.,-0.348542,-0.9221495
4296,68099,1,3,You know what’s dark?,The future of this sub’s mods,0.32876495,1.0261902
4297,13462,1,8,A blind man walks into a bar.,And a table. And a wall. And a staircase.,0.14017026,0.030385256
4298,12902,1,162,Where are all of the quiet black people kept?,Dead and hanging in the forest.,-1.4311448,1.0019209
4299,49316,1,11,What do black slaves and this post have in common?,They're both gonna be locked,0.8841938,1.5466758
4300,23209,1,1,The Jew jokes on this sub are overdone.,But hey they're used to being burned to a crisp.,0.44830927,-0.40659916
4301,11275,1,42,I don't understand why someone looks at a burn victim and says they have been burned beyond recognition,I'm confused because I can recognize a burn victim right off the bat,-0.015043045,-1.1047077
4302,36544,1,25,How do you relieve your friend of his depression/suicidal thoughts?,You do nothing and wait for the news in the morning paper everyday.,-0.29377127,-0.3850172
4303,74395,1,5599,Why are all pilots not participating in Malaysian protests?,"Because the last time it happened, we lost 239 people.",-0.47502154,0.035532095
4304,77826,1,13,How do you turn a blind man gay?,You leave the plunger in the toilet,0.75287205,0.23465702
4305,25391,1,17,Kill gays,You ever just swear to flex on no swearsies 🅱iggas,-0.5075976,1.0959908
4306,51198,1,1,My dad died when we couldn't remember his blood type,"As he died, he kept insisting for us to ""be positive,"" but it's hard without him.",0.25839803,0.012015342
4307,17506,1,6,"Was watching Black Panther, really thought there was a person inside the suit",Turns out it was a black,-0.29778022,-0.67914075
4308,56656,1,1,A Jewish girl asked for my number,I said we use names here,-1.0144563,1.0746565
4309,79339,1,94,Why are there no medicines in Afrika?,Cause u can’t take medicine on a empty stomach.,0.40508386,0.428089
4310,34544,1,7,"Do you know why the only black people in Star Wars are Mace Windu, Finn, and Lando?",The rest are in prison. ,-0.9583263,0.737223
4311,68079,1,7,Whats the difference between a black man and a trampoline?,You can't jump on a trampoline with your shoes on.,1.0008494,-1.0868013
4312,44132,1,83,My girlfriend broke up with me so I stole her wheelchair,Guess who can crawling back,-0.7947399,0.82672566
4313,76537,1,43,My aunt told me to turn on the vegetables for dinner,Fingering her tetraplegic daughter wasn't the right move,1.6723108,0.16226278
4314,16178,1,115,"My wife told me ""Dad"".",That was her first words maybe that might be explain it.,-0.7483422,0.5136734
4315,21476,1,1,What's the only thing that's richer than a Jew?,I heard asphyxiant gases are very rich in hydrogen cyanide.,0.8498893,-0.1827381
4316,32532,1,1,Why didn’t Monica Lewinsky vote for Hillary Clinton?,The last clinton presidency left a bad taste in her mouth.,1.1350641,-0.83303845
4317,50818,1,1,Child birth,So easy a women can do,-0.6723549,1.2341769
4318,20195,1,8,How do you find a 400lb woman's vag?,"Flip through the folds until you smell shit, then go back one.",-0.62985796,-0.40017503
4319,60460,1,40,Horror movies are like Michael Jackson,"When they get turned on, kids tend to run away",-0.5389776,-0.04098866
4320,45125,1,29,How did Burger King get Dairy Queen Pregnant?,He forgot to wrap his Whopper,-0.10088228,0.24255612
4321,53379,1,5,I hate my neighbour. I recently found out he's a paedophile,"No matter what I do, he won't give me any tips.",-0.06647574,-0.83124137
4322,81968,1,38,What's the similarity between a pregnant 12yo and her daughter?,"They're both thinking ""ah shit, my mom's gonna kill me""",-0.27365917,0.13610889
4323,42068,1,28,How do you know the Muslim kid next door will someday be the talk of the town ?,You wait for him to blow up. ,0.3855677,-0.18423021
4324,12373,1,79,I dont eat M&amp;Ms in dark room.,It's really difficult to seperate them by colour you know.,-0.31907275,0.71841866
4325,52427,1,1,I like my woman like my eggs,In the kitchen and not talking,-1.8006172,1.3552369
4326,85230,1,0,What is the most respectful way for a guy to dump his girlfriend?,By cutting up the body into 100 equal sized pieces ofcourse.,0.076859824,-0.43365896
4327,67311,1,2,Social distancing sucks,Do you know how hard it is to rape a bitch from 6 feet away?,-0.43151084,-1.2068423
4328,58618,1,46,"What's something that starts with ""m"" and ends with ""arriage"" and is a man's favorite thing?","A Miscarriage, the joke never gets old, just like the baby.",0.081037186,0.9267296
4329,80493,1,337,A man walks into a library and asks for a book on how to commit suicide,"The librarian says “fuck off, you won’t bring it back”",1.6145012,-0.46533692
4330,50057,1,0,Time to move on,this sub has turned to trash. it’s been a good game fellas.,-0.28867605,0.34690756
4331,9482,1,2,What do you call 1 million jews on a train?,Anything they arnt coming back,0.14385207,1.2771524
4332,82548,1,1,"Yesterday, I saw my daughter kill a butterfly out in the garden.","Just to teach her a lesson, I told her, ""no butter for a month."" Today, in the kitchen, she kills a cockroach. I said, ""nice try.""",0.6174419,-1.0501941
4333,37353,1,1,(OC) What do you call xxxtentacion’s current relationship?,A match made in heaven,-0.9436034,-0.71066314
4334,8607,1,49,How do you make an orphan's hands bleed?,Tell him to clap until his parents come for him,0.8865948,-0.7415339
4335,85461,1,46,I love Islam so much,I would rate it a 9 out of 11,-0.3205481,-0.61461645
4336,84446,1,17,Why did Princess Diana cross the road?,Because she wasn’t wearing a seatbelt,1.821634,-1.3933486
4337,44579,1,1,My crush told me she loves me like a brother.,I just hope she’s as fond of incest as I am.,0.52438563,-1.1086749
4338,39988,1,12,Why the fuck do I have like 7 posts from this sub with 40 upvotes in r/all,And I fucked a goat or something so this doesnt get banned,-0.18536833,0.6085144
4339,49789,1,2,What's the best part about knocking up an anti-vaxxer woman?,You'll only have to pay child support for about 4 years.,0.17702319,-1.1071502
4340,28531,1,27,I like my women like I like my wine.,12 years old and locked in a cellar.,-2.0015216,0.56580067
4341,80866,1,2,My wife told me to be more in touch with my feminine side,So I crashed the car,0.09907104,1.1839811
4342,9796,1,30,i like my dog like i like my babys,with a dick inside it,-2.2537165,1.5377574
4343,75896,1,1,I used to confuse Stephen Hawking and Tony Hawk,Understandable since they both loved ramps.,0.6753404,1.2533088
4344,48018,1,1,Girls are just like blackjack,I'm always aiming for 21 but end up hitting on 14,-0.66284674,0.35886225
4345,84312,1,41,I just joined this sub thinking I had found one for me,Wtf is going on with all the BLM stuff I mean I’m all for it and constantly argue with my friends about it but it seems a bit much,-1.0186529,0.21502182
4346,53958,1,159,What is the difference between jesus and kid in my basement?,jesus floats on water while he didnt,0.22345841,-1.179134
4347,31978,1,2,how did rihanna find out that chris brown wasn’t interested in her anymore?,he stopped hitting on her. ,-0.7227118,-0.078371935
4348,56578,1,3,When should you stop boiling the vegetables?,When the tard guard walks in the room,0.9931708,-0.64941365
4349,25653,1,5,This kid was beating up my wife. So I beat him up.,Now my wife isn’t pregnant anymore.,2.2438688,-1.6991284
4350,20050,1,6,How did Verne Troyer die?,He fell off the curb.,0.5760914,-0.10696083
4351,41997,1,33,Why do disabled people get bullied so much,Because they can't stand up for themselves ,-0.13391033,-1.6476185
4352,30096,1,4,I don’t get why all the black people are acting like Black Panther is their first big movie,When Planet of the apes has been around since the 60’s,0.6769501,-1.1068692
4353,51638,1,1,I called the suicide prevention hotline in Iraq,They got all excited and asked me if I could drive a truck.,-0.57682425,-0.48167852
4354,38756,1,1,I’m so proud of my son for losing his virginity,Unfortunately he didn’t live to see it.,1.5104257,-1.528073
4355,8892,1,43,Why do black people only have nightmares?,Because we killed the only one that had a dream,-0.6469766,1.0977703
4356,80761,1,13,"I’ve been thinking about starting a blacks-only apprenticeship program,","It’s called Monkey See, Monkey Do",1.0195358,-1.0407898
4357,31564,1,84,What is June 16 for a black guy?,A non-working holiday for black people cause they never go to work. ,-0.6295508,0.003278531
4358,67911,1,5285,The black community has nothing to worry about regarding complying with the CDC face mask recommendations...,Crime statistics show full compliance already.,-0.083924174,-0.5313619
4359,31848,1,0,My English teacher told me words have much deeper meaning than numbers,So I told her 9 11,-0.82818496,0.7004023
4360,63804,1,8,I never understood school shooting jokes,I guess they are aimed at a younger audience...,-0.73938376,0.060004413
4361,75215,1,1,Why did the chicken do a drive-by shooting?,Because buck-buck bucka bucka mothafucka!,-1.2045465,-0.07381577
4362,72532,1,56,Did all Europeans give Native Americans smallpox on purpose?,Or is that a blanket statement?,-0.34718183,-0.61421317
4363,83661,1,302,I once met a guy from Chernobil,"Jeez, he had a great sense for tumor",-1.0290605,1.7255331
4364,32807,1,4,My daughter’s pussy is like a bank,Time for me to make a deposit,-0.96178997,0.2474628
4365,82084,1,37,What’s the difference between a feminist and a suicide vest?,A suicide vest actually gets someone accomplished when triggered.,-1.0713079,-0.088896535
4366,72483,1,4,If Jimmy Neutron shot himself in the head,Would it still be considered a Brain Blast?,-0.73124015,0.08664141
4367,33506,1,108,What does darkjokes and 9/11 have in common?,They were both inside jobs,0.07203858,0.56007546
4368,32831,1,5,What’s the difference between a Muslim and a depressed teen?,The depressed teen doesn’t die at the start,2.1880982,-1.1220038
4369,72359,1,3,What is similar between bacon and foreskin?,The Arabs can't have them,-0.59013635,1.6670376
4370,15622,1,0,Some tips when you finally get to experience the big wide world out there.,You either kill yourself or get killed.,-0.411274,0.56120163
4371,37578,1,1,What do job opportunities and me have in common?,My uncle has taken advantage of both.,1.1372087,-0.047975026
4372,68984,1,4,My son is like a sandwich,I made him so I can eat him,-0.43171063,-0.1831931
4373,22760,1,78,What's Africa's literacy rate?,"Well, first we need to get them to read the percentage...",-0.21430363,-0.603678
4374,21682,1,1,The best thing about being a muslim is,you can get stoned without smoking weed. ,0.88765574,-0.093909405
4375,57019,1,1,When Im wet my pussy is like a slip'n'slide.,Only kids under 12 can ride it.,-0.9076404,0.7910918
4376,79705,1,2,What did armless Timmy get for Christmas?,"Don't know yet, he didn't open it yet",0.4745321,-1.4495691
4377,39078,1,58,I've heard like Seven Cancer jokes today,If I hear tumor it's gonna benign,-0.29923725,-0.06459278
4378,58328,1,13,Do you think the soldier that put Jesus to the cross got a raise afterwards?,Hope he did cause he really nailed it!,-0.8323641,-0.47991678
