,Unnamed: 0,joke_type,score,title,selftext,surprisal,entropy
0,1342,0,15,"I don’t want to brag, but I do speak pig Latin...","I mean, I’m not fluent, but I’m sure if I ever went there, I could get by...",-0.29709446,-0.69844806
1,7381,0,55,"I hate that SEPTember, OCTober, NOVember and DECember aren't the 7th, 8th, 9th and 10th months...",Whoever messed this up should be held accountable,0.5420984,-1.1135757
2,6678,0,12,"3yr old Daughter, “Why did the chicken climb on top of the house?”","7yr old Son, “He was a Roofster.”",0.8947471,-0.5022436
3,6378,0,1,I told my daughter that I saw a deer on the way to work this morning. She asked me...,“How do you know it was on it’s way to work?”,1.6807737,-1.9546263
4,6035,0,556,What did the dog say when he bit the sandpaper?, Nothing. He just grit his teeth.,0.30038193,-1.7169491
5,692,0,54,Have a very Joseph Christmas!,"We shouldn't discriminate by sex, you know.",1.4885801,-1.2518466
6,5041,0,9,"My wife is happy with COVID-19. I must not kiss nor hug anybody, always keep a safe distance and avoid public places and social occasions.","To be honest, she was always happy with her Redditor husband.",-0.10619385,0.82539284
7,6510,0,199,My teenage son got a summer job that required him to drive a pickup on a large ranch.,So I gave him a crash course,1.3808298,-0.8314247
8,5465,0,1063,I have a joke on reddit,But no one will read it!,-0.8835961,0.48434582
9,1611,0,18,Did you hear about the guy who dreamed he was eating a giant marshmallow?,"When he woke up, his pillow was gone.",0.3307184,-0.97239333
10,1333,0,67,So I started telling these jokes to an egg.,"The egg replied ""That really cracks me up""",1.4844428,-1.2012659
11,1305,0,0,Is it just me or do alligators always look like...,...they are in the middle of a push-up?,-0.87009126,0.8456808
12,3445,0,1,Jello has created a product that deters insects.,"It's very effective, but the flavor is OFF-pudding.",0.29197398,0.20930006
13,76,0,37,So I was feeling down the other day...,"My friend wanted to cheer me up, so he told me 10 jokes to make me feel better. Unfortunately, no pun in ten did.",0.06954769,-1.2991993
14,5661,0,14,I use to work at a factory that made fire hydrants,You couldn’t park anywhere near it,2.0796309,-1.1681061
15,5420,0,23,Why did joe go on a date with a prune?,He couldn't find a date!,0.5547038,0.14348859
16,7208,0,1,"An optimist says, “the glass is half full.” A pessimist says, “the glass is half empty.”","An optometrist says, “you both need glasses.”",3.152194,-2.5200481
17,2916,0,1,How did Van Gogh start his speech?,"Friends, Romans, countrymen, lend me your ear",-0.18657319,-0.5194877
18,453,0,44,What's the best part about twenty two year old wheels of cheese?,There are twenty of them.,0.0048221154,-1.9316739
19,6001,0,400,"I gave my french girlfriend a pendant with ""le monde"" carved in",It means the world to her,-0.18812183,-0.7645576
20,3948,0,8,I've opened a barber shop for rabbits.,We only do hare cuts.,-0.17512296,0.0474169
21,2661,0,1,"The word ""suolucidir"" may look silly.","But backwards, it’s just plain ridiculous.",0.6370715,-0.22612305
22,2400,0,78,How do you get revenge on an egoist?,An I for an I.,-1.9502721,0.987411
23,2748,0,145,How do you know that carrots are good for your eyesight?,Have you ever seen a rabbit wearing glasses?,-0.094264634,-0.54656255
24,786,0,34,"What is black, white, and red all over?",A Communist Propaganda film from the 1930s. ,-0.6045224,1.1607164
25,5133,0,1162,I once fell in love with a girl who only knew 4 vowels…,She didn’t know I existed…,2.574363,-1.2212567
26,3988,0,241,So there's a new hotel that's just opened up called 12:59:59pm.,I heard their service is second to one.,-0.28104547,-0.72408664
27,6841,0,11,Did anyone hear about the rumor about butter,"If not, don’t worry I won’t spread it",1.4878795,-1.6248244
28,5818,0,1,"I used to work as a computer programmer installing auto correct, but one day..",..they fried me for no raisin.,-0.2190542,0.44911182
29,5253,0,17,You ever hear the one about the bad meat carver?,"Yeah  me either, he couldn't make the cut.",-0.6982461,-0.5023577
30,5914,0,39,Why did the hippo get kicked out of the nightclub?,He had a big mouth,-1.2932918,2.5152586
31,711,0,17,Someone dropped their Scrabble in the middle of the road...,...that's the word on the street anyway.,-0.074252896,0.2853915
32,1554,0,47,Is Google male or female?,"Female, because it doesn't let you finish a sentence before making a suggestion.",0.02985925,0.34090555
33,7164,0,0,She applied at the post office but they wouldn't letter.,They said it's all mail there.,0.052618377,0.10777798
34,6284,0,83,"Two giant windmills are out on a hilltop. One turns to the other and asks, ""What kind of music do you like? ""","The other one says, ""I'm a really big metal fan. """,-0.006263428,-0.56475806
35,743,0,6,I'm getting mighty fed up with these sheep-human hybrids!,What is with ewe people!?,-0.0008855522,-0.053207178
36,5701,0,12,What's the difference between a hippo and a zippo?," One is really heavy, the other is a little lighter",-1.0762975,-1.0092064
37,5864,0,22,"Today, a nintendo factory was burnt to the ground. The factory was making the next gen nintendo cons"," ...""Wii didn't start the fire.""",-1.127711,0.8121568
38,4883,0,1,So i stubbed my toe this morning...,My toe hurts but The Opera Director Next door was very impressed,-1.2428834,1.949521
39,1298,0,18,Show me a piano falling down a mineshaft...,And I'll show you A-flat-minor,-0.042489056,0.7770499
40,5052,0,835,How did Thomas Edison invent the lightbulb?,He had a bright idea,-0.75671786,1.043204
41,3203,0,9,I tried to explain to my 4-year-old son that it's perfectly normal to accidentally poop your pants...,...but he's still making fun of me.,0.38428777,-0.026683247
42,6458,0,151,What's the difference between a taking an oath of office and old clothes?,"One is sworn in, the other is worn out.",-0.7137882,-0.86131245
43,5019,0,1,What’s the best cheese to bait bear traps with,Cammom-bear! (sorry if ya heard this one already),-1.5265707,1.5906984
44,5892,0,1,I submitted a 16:9 picture of my farm to the photography contest.,They didn't like the crop.,0.9517374,-0.46962994
45,1356,0,1,"I don't get it, I clicked ""Suspend"" from my computer's system menu, the screen went black...",...but how come the computer is still sitting on the desk?,-0.9936114,0.5155626
46,974,0,50,Why did Beethoven get rid of his chickens?,"All they said was, “Bach, Bach, Bach …”",0.2969444,-0.33749682
47,6878,0,65,What's the difference between a Hippo and a Zippo?, A Hippo weighs 700lbs but a Zippos a little lighter,1.5537062,-1.7288928
48,6909,0,457,You cannot fish a tune,... but you can tuna fish.,-2.5798652,0.49236587
49,4158,0,8,Chess,So I started practicing my chess skills the other day. I've played against myself over 100 times! I'm pretty sure it's working! I haven't lost a single game yet,0.08039767,-0.10902272
50,3858,0,4,People think that being a taxi driver with dyslexia is difficult.,"It's as easy as C, A, B.",0.26009062,-1.1656022
51,5680,0,1,"I used to have a total obsession with plumbing parts, but after years of therapy..",.. I finally got it out of my Cistern.,-0.030179445,-0.6484012
52,960,0,5,My girl asks why I love chocolate so much.,"Well, I have several Reisens...",-0.28205493,0.49454322
53,6644,0,1,"I owe my taylor a lot of money,",but he's agreed to cut me some slacks.,0.3578006,-0.63443327
54,4048,0,356,A mathematician wakes from a nightmare in which he encountered a creature with only one eye.,"“Thank goodness,” he says. “It was imaginary.”",2.917336,-0.7626859
55,5156,0,13,Ever heard of the group of religious cannibals?,In Sundays they eat fishermen.,-0.40407005,1.8686873
56,5534,0,0,My Wife has recently booked me onto one of these wacky escapology courses. Just not my thing..,..and I'm struggling to get out of it.,-0.14524102,0.06553327
57,5116,0,19,Why should people with heart disease avoid sleeping outdoors?,Because camping is in tents.,0.37166145,0.6237901
58,5869,0,3,Video chat has really saved the tourist industry in Rome during this pandemic.,Now instead of tourists traveling to visit the ancient ruins they can just call-n'-see-'em.,0.16471794,0.2560091
59,7012,0,65,What did the day old loaf of bread say to the baker as he was tossing it in the compose bin?,Would you please stop you kneaded me yesterday?,0.47715035,0.8411774
60,5507,0,1,My late Father drove JCB's all his working life. Colleagues at his funeral told me that he has left behind..,..a hole that can never be filled.,-0.15905914,-0.6956605
61,920,0,40,"We always bought our cars used, this one was as black as the night-","-that is, until we washed it!!!",-0.82429814,-0.02681173
62,696,0,11,What do you say when you find two banana peels together?,Answer: A pair of slipper,0.22607145,0.5830224
63,4363,0,0,I turned in my project on gingivitis just in time!,I made it by the skin of my teeth.,0.032013368,-0.6467138
64,2889,0,2,Why did the robber hide in the bathtub?,To make a clean getaway.,0.9177636,-0.57527065
65,3907,0,48,Why are cars good cleaners,Because they go broom broom,-0.26166365,0.77957636
66,2333,0,31,She gets her way by pretending she's sad.,She's an expert in sighcology.,-0.045260005,0.8483587
67,6488,0,2,Really struggling for a cleanjoke today. Though I do have one about unrefined oil..,But it's a little too crude for here.,-0.56131357,1.0177672
68,6062,0,1,My grandfather got caught cutting corners at work and received a promotion!,He was in charge of laying the railroad track.,-0.49795517,0.4150139
69,1297,0,4,Why do pirates spend so much time on the alphabet?,Because they always get stuck at sea,0.024662847,0.22343382
70,6282,0,0,I bought some whipped cream.,It's like regular cream but its wife wears the trousers.,-0.6143551,0.7910034
71,3939,0,3,Who do you call when you break your toe?,The Toe Truck (Tow Truck) ,-0.41557437,1.0618706
72,6094,0,125,There are three kinds of people in this world,"those who are good at math, and those who aren't.",-0.4628742,-1.2144129
73,6796,0,152,Why was tigger looking inside the toilet?,He was looking for Pooh.,-0.03370682,0.49387887
74,1732,0,35,"A police recruit was asked during the exam, ""What would you do if you had to arrest your own mother?""","He said, ""Call for backup.""",2.3092103,-2.0888593
75,1502,0,38,My grandmother is 92 and still doesn't need glasses,She drinks straight from the carton!,0.38969183,-0.74372494
76,1254,0,11,Exit signs...,...are on the way out...,-1.1921033,1.73646
77,6445,0,10,What's the difference between a rain gutter and a clumsy outfielder?," One catches drops, the other drops catches.",-1.1826056,-0.2587696
78,6929,0,364,They're making a new wheel beside the Thames and it's going to be Mary Poppins themed.,It's going to be called the Londiddle-diddle-um-diddleye,-0.3510992,0.37032393
79,5457,0,1298,My wife has been wanting to have a baby for 5 years...,I have to keep reminding her that you have to keep them forever,-0.45703304,-0.14659238
80,4560,0,11,Apparently one in three people cheat.,I wonder if it's my wife or my girlfriend.,-0.17707293,0.13406208
81,4454,0,1,Oh no... I copied the wrong document...,... it was an original mistake.,-1.3623875,1.588442
82,2121,0,28,"Why do we tell actors to ""break a leg?""",Because every play has a cast. ,0.46981466,0.6210663
83,1485,0,0,Turns out that the button in the elevator with the fireman's hat on it...,Is *not* the button you push if you want a fireman's hat...,0.1735499,-0.9140386
84,2675,0,85,I bought them a new refrigerator.,I can’t wait to see their faces light up when they open it.,0.80169696,-1.173289
85,3110,0,3,"A man wakes up in a hospital after a serious accident and shouts, ""Doctor, doctor, I can't feel my legs!""","The doctor replies, ""I know you can't, I've cut off your arms!""",0.70751256,-1.4472417
86,4539,0,565,My girlfriend was crying because she got a bad haircut,"I said, ""why are you crying? I'm the one that has to find a new girlfriend""",-0.037586674,-0.7448117
87,1088,0,18,Why are karate instructors the worst party guests?,They always show up empty handed.,0.6621313,-0.76269716
88,6979,0,122,What did the hotdog say to the bun?," Listen buddy, i'm going to be frank with you.",-0.82567316,-0.67692566
89,1015,0,0,Did you know yesterday was National Middle Child Day?,"Don't worry, no one else remembered either. ",0.41638228,-1.0025113
90,5572,0,1,You know that theory about no two people see colors exactly the same way..?,.. surely it's a pigment of their imagination.,-0.54153305,1.1739204
91,6698,0,21,I need some good sailor jokes,"My brother is coming home for a family gathering, and we have a big family gathering with young cousins. Any PG jokes available would be amazing.",-0.5011876,0.12347101
92,6894,0,12,What's the difference between an optimist and a pessimist?," One sees a glass half full, the other doesn't care because the glass is going to fall and break anyways.",0.3277058,-1.8310021
93,2308,0,85,Why couldn't the lifeguard save the hippie?,He was too far out,-0.10048531,0.54434645
94,5704,0,1,Napa Valley has developed a new hybrid grape that acts as an anti-diuretic!,They will be marketing the new wine as Pinot More.,-0.61213034,0.28096864
95,7009,0,15,Do you like Almonds?," No, I do like a few-monds though",-1.406584,-0.42727596
96,3648,0,17,So someone gave me a used glove and new one....,So I got one second hand and one first hand.,-1.9738173,0.9041893
97,6196,0,541,How did the hipster burn his tongue?, He drank his coffee before it was cool.,-0.5997858,0.49694738
98,1836,0,0,"My wife just said to me, ""I was worried the mechanic was going to rip me off...""","""...but it was okay, all I needed was indicator fluid.""",0.105876274,-0.66480106
99,799,0,8,Why are bears so hairy ?,They don't have salons in the jungle ! ,0.7370874,-0.18150844
100,3793,0,123,The self-cannibal at work got into trouble for making fun of me.,He really put his foot in his mouth.,0.92172724,-1.4002805
101,5898,0,558,"At the start of my first flying lesson, I looked down nervously and asked my instructor, “What are all these buttons for?” He explained calmly…",“Those are to keep your shirt closed.”,1.6200666,-0.63241696
102,6242,0,349,A new computer virus has been discovered,"Paul Revere virus: This revolutionary virus does not horse around. It warns you of impending hard disk attack---once if by LAN, twice if by C:.",-0.6759206,0.1406976
103,7375,0,9,Life’s like a box of jalapeño peppers. What you do today…,might burn your butt tomorrow,0.6217484,-1.313107
104,7296,0,0,My books fell out of the bookcase.,I only have my shelf to blame.,-0.15579437,0.9805655
105,249,0,83,Why did the chess master order a Russian bride?,He needed a Chech mate!,-0.077539474,0.26557815
106,5873,0,557,Sine &amp; Cosine waves have their ups and downs...,but they're just going through a phase.,-0.5416098,0.10951301
107,1617,0,12,Can a kangaroo jump higher than a house?,"Of course, a house doesn’t jump at all.",2.2307086,-2.050488
108,354,0,42,"Apple just released a brand new programming language, *Swift*.",Job recruiters everywhere immediately started posting ads for Swift programmers with 5 years of experience.,0.11264486,-0.17520903
109,7223,0,4,I've started telling people about the benefits of dried grapes.,It's all about raisin awareness.,0.6144694,0.014613086
110,2717,0,23,Did you hear about the angry pancake that jumped out of the frying pan?,Things were fine until it got too hot and just flipped out.,-0.12159373,0.01361058
111,5091,0,986,What do you call a Dog with no legs?,Why bother? They won't come anyways.,0.6185124,-0.39626953
112,5938,0,690,"To the inventor of the ""knock knock"" joke",You deserve the nobell prize!,-0.60960627,1.5005113
113,6166,0,642,"I thought it was happy hour. Everyone was in line for their free shot, so I jumped in line.","Well, now I’m vaccinated for covid.",1.5171385,-1.2428966
114,2643,0,129,"""Why do you keep calling David, Dave?""","""Well, it all started when he had his id stolen...""",-0.11281237,-0.40915853
115,6889,0,80,Apparently in some countries they drive on the other side of the road.,"Personally, I can't imagine driving underneath tarmac.",0.7224492,-1.0970148
116,6210,0,23,I’ll have the Mahi,I’m not too hungry today. (Saw this in a move a while back),-1.1771013,1.6159645
117,1613,0,1,How do you get 500 old cows in a barn?,Put up a Bingo sign.,-0.22176757,-0.80482095
118,6135,0,13,Mom: Your ears look cold,6 yr son: That's cause they don't wear socks,-0.17162089,-0.12497202
119,3607,0,123,If all 't's were silent...,...we'd never hear the end of it.,-0.31298554,-0.8512285
120,2844,0,22,How do sailors get their clothes clean?,They throw them overboard and they wash ashore.,-0.069991775,-0.17993513
121,6736,0,79,How many magicians does it take to pull a rabbit out of a hat?, One. It's a trick question.,-0.057403848,-0.81913215
122,1466,0,75,What do you do with sick chemist?,"If you can't helium, or curium, you can always barium",-0.83398426,0.32337815
123,1253,0,20,I was at a funeral the other day and a couple in front of me were loudly arguing about which herb goes best with which fish…,I could only think it wasn’t the Thyme or Plaice…,1.8650907,-0.48762915
124,921,0,9,"You can pick your friends, and you can pick your nose...",But you can't pick your friend's nose,0.13559331,-0.75706893
125,5342,0,1,Shame what happened to that pirate captain.,It was an aye opener.,-0.02500747,0.74624693
126,6619,0,31,Do you know what the French word for “honor” is?,"No? Don’t worry; nobody else knows, either.",1.7558799,-2.1223981
127,4465,0,24,"Neighbor's Sign On Front Door: ""No Visitors.""",Name under sign: N. Vitamin,-1.1765271,1.935294
128,5868,0,540,Why do cats never form their own religion?,It was always too dogmatic.,1.1075771,-0.28904554
129,4875,0,50,It's not that hard to tell an alligator and a crocodile apart..,## One will see you later and the other will see you in a while,-0.85224235,0.25611395
130,4179,0,7,Do you know what I said to the person who was chasing me?,I relish the fact that you’ve mustard the strength to ketchup to me.,0.7176349,0.5341964
131,725,0,20,I fell off a forty foot ladder today....,lucky I was on the bottom rung.,-0.3881083,-0.14735608
132,2113,0,0,Does Obi-Wan Kenobi sell Pokémon-themed instruments?,No. Only a Sith deals in Absol lutes.,0.33763793,0.018630648
133,4597,0,0,"Many people think the forbidden fruit in the Garden of Eden was an apple or fig, but many scholars now think it was, surprisingly, a mango.","For God said to Adam on that infamous day: ""Now that you have partaken of the fruit, Man, GO!""",0.6096386,-2.0503674
134,6324,0,1,Why did the lion cross the street?,He saw a zebra crossing,1.9041021,-0.48645157
135,3784,0,66,Why did no one want to marry the tennis player?,Love meant nothing to him.,0.6611864,-0.26037887
136,6089,0,44,I watched an Australian cooking show and everyone cheered when the chef made a meringue.,"Seemed weird to me, I thought Australians always boo meringue.",2.035349,-1.5996727
137,5750,0,24,I just bought a new boomerang, How do I get rid of the old one ?,-0.71804583,-0.43281886
138,1103,0,136,It's my daughter's birthday today...,"...so I wrapped up some batteries, with a note saying, ""Toys not included!""",-0.09006284,0.34790322
139,649,0,3,Why did the Buddhist monk refuse Novocain?,Because he wanted to transcend dental medication.,-0.12357248,0.14764765
140,3060,0,151,How many ears does Captain Kirk have?,"Three: the left ear, the right ear and the final frontier.",-0.9312659,-0.8888821
141,6222,0,289,I can see the future,But it takes me a while.,-0.053862512,-0.8538033
142,908,0,0,How do you kill bread?,"Bake it for a little while, and it will be toast.",-1.0377991,-0.0041823625
143,5504,0,18,I'm having real problems with a sleep paralysis condition lately. In fact,..Its turning out to be a nightmare.,-0.7324564,-0.6034272
144,6466,0,0,What's the difference between a well-dressed man and a tired dog?,"The man wears an entire suit, the dog just pants.",-0.83970416,-0.02891062
145,4933,0,1,Why can't trees time-travel?,Because travelling through time petrifies them!,3.2857363,-2.19775
146,4345,0,154,Can vegans eat pudding?,No! How can you have any pudding if you don't eat your meat!?,-0.0056605544,-0.9429208
147,6587,0,218,As a retired chemical engineer I like to keep my skills sharp.,"So I spend my days turning wine, beer, and margaritas into urine",1.2182275,-0.07012849
148,1735,0,55,What do you call a computer floating in the ocean?,A Dell Rolling in the Deep.,-1.9338541,2.171168
149,6349,0,27,A friend of mine made a terrible mistake at work.,When he came in the next day his face was purple. His co-workers told him he shouldn’t beet himself up.,1.495497,-1.2935762
150,3330,0,1,You can kill vegetarian vampires...,...with a steak to the heart.,-0.9570612,0.88674855
151,4774,0,1,Barney Rubble's previous wife was very weak,"Which might explain why she was called ""Vulner"".",0.19522543,0.95228356
152,1131,0,0,I saw a strange man at the pool today.,He said his name was Bill Yurds.,0.4011787,0.0071597304
153,2653,0,23,YOU WILL PAY FOR YOUR SINS!,"If you have already paid, please disregard this message.",-0.5996471,-0.46802887
154,2123,0,16,Helvetica and Times New Roman walk into a bar...,"""Get out of here!"" shouts the bartender. ""We don't serve your type.""",1.0132244,-0.41896775
155,5406,0,66,Two Books meet up in a Library. One says ' You don't look very well at all ' and the other replies...,...' I've just had my Appendix removed ',-1.0677892,1.3649187
156,7149,0,78,When the shoe salesman offered me Velcro shoes,"I said, ""Sure, why knot?""",-0.20327654,-0.91562116
157,324,0,28,A man walks into a fancy dress party carrying a woman on his back...,"The host asks the man why this is so. ""Oh, I'm a tortoise and this is Michelle"" says the man.",0.13850473,-0.9278239
158,4617,0,43,I’ve got this awful disease where I can’t stop telling airport jokes...,The doctor says it’s terminal.,1.019281,0.16664524
159,4208,0,0,Christians and Jews are as different as men and women.,There's always arguments between the opposite sects.,0.63792825,-1.2976476
160,6076,0,1,"I tried cooking with wine last evening, for the very first time.."," ..but after four glasses, I forgot why I was in the kitchen.",-0.41864806,-0.4720266
161,6275,0,583,I was telling my children about the health benefits of eating dried fruits recently.,It's really all about raisin awareness..,0.3310892,-0.4094556
162,5381,0,821,What did the sand say as the tide came in ?,Hey ! Long time no sea.,-2.7614079,-0.107375056
163,4870,0,1,I respect tyres.,They've got plenty of wheelpower.,1.3989413,-0.25692117
164,3490,0,1,I was up all night trying to figure out where the sun went.,Then it dawned on me.,2.1536777,-2.7278054
165,479,0,35,There's a wreath hanging on my door with hundred dollar bills attached.,I call it an Aretha Franklin. c:,0.048447993,0.94208515
166,4218,0,1,Is Google male or female?,"Female, because it doesn't let you finish a sentence before making a suggestion.",0.02985925,0.34090555
167,2812,0,12,Why did the sun not go to college?,He already had a million degrees.,-1.3562315,1.6252893
168,1606,0,1,My friend thinks he is smart.," He told me an onion is the only food that makes you cry, so I threw a coconut at his face.",-0.90237683,-0.15953587
169,6411,0,323,What do you call it when a giraffe swallows a toy jet?,He has a fuselaged in his throat.,0.2140733,1.2185062
170,4215,0,3,I gutted a grammar-Nazi today; he wouldn't stop correcting my punctuation.,Now we're both using our semi-colons correctly!,1.2406211,0.6291391
171,3057,0,15,"I always used to get small shocks when touching metal objects, but it recently stopped...","Needless to say, I'm ex-static...",1.4439998,-0.6461701
172,4257,0,10,My girlfriend repeatedly kept calling me a flamingo!!,So I had to put my foot down,-0.31640476,0.01959067
173,4898,0,4,Ikea failed miserably at processed meat products business,Someone ordered meatballs and Ikea sends them a cow with DIY instructions,0.1512785,1.2408923
174,4172,0,1,My Computer is a lot like a Chargers game,They both only have two fans,-1.1208736,1.5992742
175,1186,0,1,"I just got kicked out of Karaoke night for singing ""Danger Zone"" six times in a row…",They said I exceeded my maximum number of Loggins attempts.,1.343545,0.39816934
176,5154,0,19,What do you do when you break a stick of asparagus?,I don't know I would just get a-spare-i-guess,0.37982163,0.22161417
177,450,0,3,What's faster hot or cold?,Hot! Because anyone can catch a cold! buh duh tsst ,-1.3624766,0.518147
178,1823,0,72,The worst part of having insomnia,Is knowing I have to eat spiders while I’m awake to maintain my yearly average.,0.16071333,-0.11814018
179,238,0,61,What's the difference between unlawful and illegal?,Unlawful is against the law and illegal is a sick bird.,0.781762,-1.9076706
180,401,0,25,After watching a strongman competition...,it amazed me to see how much the human body can lift without pooing itself.,0.13920793,-0.26075816
181,4062,0,74,I couldn't remember if the sun rose in the east or the west,and then it dawned on me,-0.24461307,-1.1657861
182,632,0,64,Did you hear about the skeleton who didn't go to prom?,He had no body to go with.,-0.82640254,-0.1933696
183,3346,0,0,A vulture walks on to a plane with two dead raccoons.,"The air hostess says 'Sorry, we only allow one carrion'.",0.544393,-0.16799755
184,5981,0,7,I went to buy a ticket to the United Arab Emirates...," and when the clerk offered me a great deal, I said to him ""Do buy!""",-0.5174094,-0.5903908
185,5557,0,27,You would think that a Snail without a shell would move that bit faster ?,But it's actually more sluggish.,-0.3566638,0.065802574
