,Unnamed: 0,joke_type,score,title,selftext,surprisal,entropy
2848,5970,0,6,So the batteries in my flashlight ran out...," You'd think I'd be sad, but really I was delighted.",-0.17943206,-0.8793617
2849,3448,0,117,What is a birds favourite social media app ?,It's tweet-er of course ! ,-0.05801719,0.49264306
2850,3808,0,184,My friend said ALL comforters are too hot....,I told him that was a blanket statement.,-1.0260749,0.6966198
2851,3392,0,4,If I were incredibly rich...,"...I would hire two private investigators, and get them to follow each other.",-0.21691579,-0.09573249
2852,2256,0,12,I told my friend that he'd be great at making Sunday lunches.,Because he's an excellent roaster.,1.3869736,-0.6285409
2853,4926,0,372,"Michael Jackson, Tupac, Biggie Smalls, and Elvis all walk in to a 7-eleven","You wouldn’t believe it, that store was dead.",0.5494385,-0.51371384
2854,7314,0,34,What's the meaning of ignorance and apathy?,I don't know and I don't care.,1.3862435,-2.033929
2855,4407,0,379,All I got for Christmas was a pack of sticky cards.,It was difficult to deal with.,1.0064095,-0.5341453
2856,2660,0,87,Those are my principles.,"If you don't like them, i have others.",0.52220094,-1.5169666
2857,2893,0,1,"Why did the cat say, ""moo, ruff, oink""?",He was learning foreign languages.,0.6450519,0.5079684
2858,1557,0,17,What did the duck say when he bought lipstick?," ""Put it on my bill.""",-1.4323392,-0.34706277
2859,2055,0,67,A photon walks into a hotel with no luggage and goes to check in.,"The bellhop asks if he has any bags. The photon replies, “No sir; I’m travelling light.”",1.619442,-1.1687595
2860,4536,0,434,Me and my girlfriend are just too different...,I exist and she doesn't,1.1005119,-1.4474713
2861,3838,0,1,Fifty Shades of Gray has beat records for the fastest selling R rated movie,"Well, first it tied the records up, then it beat them…",-0.94078445,-0.40915614
2862,5237,0,717,To be or not to be...,"is technically, not a question",-1.687886,0.4886553
2863,5612,0,5,Why dont you ever see elephants hiding in trees?, Because theyre really good at it!,-1.193124,-0.23485643
2864,1154,0,83,I sat up all night to figure out where the sun went...,and then it dawned on me!,0.54182357,-1.8245486
2865,4111,0,662,Did you hear about the guy who flew so close to the sun that he touched it at exactly one point?,He was a real tan gent.,-0.71322286,1.6737639
2866,4135,0,5,The Bard's barber often asked him if he preferred a clipper cut.,"And every time, William spake ""shears.""",1.424829,0.69187284
2867,4140,0,45,"Hey, can I get some feedback on my joke?",\*Makes a high-pitched screeching sound\*,0.8426426,-0.5444938
2868,1551,0,0,The worst part about working for the department of unemployment...,"...is that when you get fired, you still have to show up the next day...",-0.4053709,-1.572974
2869,1331,0,43,Face is a four letter word…,But preface is a foreword letter…,-0.20033285,0.4753661
2870,4361,0,9,Did you hear about the train robbery down in Mexico?,They said the robber had a loco-motive.,0.9530365,0.62178683
2871,4307,0,1,I recently started dating an archaeologist.,It just goes to show that they will date anything.,0.2020071,-0.6695816
2872,5105,0,21,The early bird gets the worm, but the second mouse gets the cheese.,-1.8314668,1.4509691
2873,349,0,0,What do you do if you see a spaceman?,"You park in it, man.",0.40851265,-0.18722643
2874,3018,0,6,What would Jesus do if he worked at McDonalds?,He'd fry for your sins.,0.31907448,0.82499886
2875,4463,0,1,I just bought a movie with 3.142 stars out of 5,It was a pi rated DVD,-1.8171618,1.2650326
2876,4230,0,1,"What do you get when you cross dyslexic, an insominac and a agnostic?",Someone who lays awake at night wondering if there is a dog.,-0.16986898,-1.0153116
2877,5337,0,21,"I said to my wife, ""I need to call the doctor today."" She asked, ""Which doctor?""","I smiled back, ""No, the regular kind.""",-0.021274192,-1.3577003
2878,5360,0,1,"I told a bunch of people an ultrasound joke, but nobody laughed.",I guess they didn't hear it.,1.1946937,-1.0027423
2879,7289,0,149,My Grandparents bought a new China set..., They asked me what I thought of it... I said it was fine...,-0.50931466,-0.911716
2880,2499,0,5,Did you hear about Alex Trebek?,His job is in Jeopardy!,1.7278624,-1.1898861
2881,2654,0,3,I thought I saw an eye-doctor on an Alaskan island,but it turned out to be an optical Aleutian.,-0.24797991,-1.0552505
2882,6127,0,1,James Bond slept through an earthquake," He was shaken, not stirred.",-0.6986117,1.1455178
2883,3383,0,68,Want to hear a dirty joke?,I fell in the mud while wearing my best suit. ,-0.850131,1.3094149
2884,707,0,0,Cogito Ergo Spud.,"I think, therefore I yam.",-1.098917,-0.66756904
2885,3803,0,14,It makes my heart race when my girlfriend rests her head on my leg during long road trips,So now she has to sit up straight and keep her eyes on the road whenever she’s driving ,0.38834998,-0.3851861
2886,6653,0,1,Sometimes I think to myself," ""I hope to god I'm not agnostic... or do I?""",-0.40532377,0.35190913
2887,4102,0,575,Idea,Could the r/dankmemes reddit be banning non europeans just as a dank meme?,-0.37567306,0.37722224
2888,922,0,0,"You can pick your friends, and you can pick your nose...",But you can't pick your friend's nose,0.13559331,-0.75706893
2889,5846,0,471,"It's pretty obvious, that if you run in front of a moving car, you will get tired. But if you run behind it..",..do you just get exhausted ?,-0.42720783,0.32536635
2890,3894,0,214,I beat my swimming coach in a boxing fight.,He threw in the towels.,2.0490918,-1.8209195
2891,2784,0,38,What's the difference between an American and a Canadian?,A Canadian not only has a sense of humour but can also spell it.,-0.45710024,0.04695813
2892,1730,0,13,Why did the belt get arrested?,He held up a pair of pants.,0.27508655,0.1515076
2893,3940,0,0,4 20,"20, 20, 20, and 20.",-4.5393,-0.4205719
2894,7087,0,47,Why is never scoring points in a tennis match not a bad thing?,You always stay at love,0.2126032,0.28430334
2895,6959,0,70,For some reason one wrong look at the Headless Horseman always made him angry.,He always lost his head,0.66027033,-0.13894783
2896,6783,0,72,Did you hear about the new corduroy pillows?,I understand they're really marking headlines.,0.48941374,0.4208621
2897,1797,0,51,Does working for UPS...,...make you a professional boxer?,-0.948833,0.96320355
2898,2525,0,4,"I saw a sign that said, ""watch for children"".","I thought, ""that sounds like a fair trade.""",-0.07010869,0.118135385
2899,5405,0,6,Wayne and William are best friends,"Where there’s a Will, there’s a Wayne",0.5228588,-0.73639524
2900,6065,0,445,i can’t take my dog to the park because the ducks keep biting him.,i guess that’s what i get for buying a pure bread dog.,-0.5275056,-0.16464536
2901,3055,0,28,Have you heard about the dog breeder who became an Olympic hurdler?,She had a great pair o' knees.,0.3085552,0.15788445
2902,6129,0,155,"My ice despenser is leaking all over the floor, but I don't think I'll fix it...",Because it's all water under the fridge.,-0.37831402,0.15343107
2903,2516,0,10,My vegetarian friends accused me of dating a meat-eater.,"But i swear, i've never met herbivore.",1.3528812,-0.6854309
2904,60393,1,2,What will the orphan do if you punch them?,"nothing, they cant tell their parents",-1.0613766,1.0347625
2905,15988,1,24,Why Don't Black Kids Shoot Up Schools?,Because it's regular hood activity. ,-0.5374133,0.5269917
2906,53435,1,3,A Black and A White Kid fighting on the floor,A perfect Ying and Yang symbol,-2.9881706,2.1702504
2907,12540,1,36,So I want to come out of the closet,but my uncle keeps putting the key in his asshole and I don't want to put my hands where my dick is going ,-0.045047995,-0.86217964
2908,38697,1,1,I think the kamakazis during WWII were all just a big accident...,"Since Asians are so bad at driving, what's to say they are good at flying?",-0.5175097,0.3419519
2909,83689,1,1,My brother was a speedrunner,He died 20 minutes after he was born,-0.51659274,0.4185258
2910,59044,1,1,I like my women how I like my leftover meat:,"Beat up, grinded, and fed to the dogs.",-0.26073623,0.16094302
2911,60995,1,56,why are black people so good at basketball?,"because its just running, stealing and shooting",-1.5074471,1.2703412
2912,74505,1,1,"Whats the difference between my wife, and my kids?",My kids can get me off.,-0.43155184,0.7612126
2913,16994,1,0,What's the difference between feminists and walruses?,"One has a mustache and smells like fish, the other is a walrus.",0.8321076,-0.1768608
2914,20930,1,0,My uncle died in 9/11,He brought 3000 infidels down with him,2.0420284,-0.96978736
2915,18622,1,1,"Jesus christ, can people stop asking for my sex slave's birthday?",I'll inform you when it happens,-0.42612422,-0.6239368
2916,59375,1,1,What's the similarity between a Tap Mobile Game and a Girlfriend?,You can use all four fingers for both.,-0.3576488,0.49605075
2917,36054,1,12,You know what's the best part about being a pedophile on Halloween?,"You don't have to look for kids, they come straight to your door.",0.75297236,-1.9459913
2918,76905,1,17,So my disabled brother started an all Down Syndrome pop band,They’re called the Extra Chromo-tones,0.9274515,1.6813749
2919,27961,1,29,What's the difference between a baby and a bowling ball?,You can only fit 3 fingers inside a bowling ball. ,-0.13232768,-0.49560294
2920,12278,1,40,How do Africans celebrate their child's first birthday?,Put flowers on their grave.,0.8371827,-0.5190971
2921,56010,1,1,okokokok,why the **fuck** is everything in Chinese?,-2.4505162,2.0002491
2922,58537,1,8,Why do flesh colored bandaids never come in black?,Cuz bandaids don't fix bulletholes,1.9041152,-1.3821179
2923,16864,1,27,What do you do if you see a wounded nigger in your backyard?,Stop laughing and shoot again. ,0.45970717,-0.54428995
2924,45271,1,123,Am one of those people that loves kids but doesn't want them to grow up,So I don't vaccinate my kids,1.5491135,-1.2671503
2925,55233,1,0,"Im so Glad cars have those ""Children/Baby on board"" stickers",Im sick and tired of going to random cars and trying to find a kid to rape,-0.9252389,-0.2514502
2926,61767,1,29,What have the Twin Towers in common with a Lasagna?,Both have grounded meat at the bottom,-0.062252138,-0.2904205
2927,76932,1,7,Trump and his wife both tested positive for Covid...,Do they share a boyfriend?,0.9339976,0.611708
2928,10303,1,9,One day a pastor rescued a poor child sex slave and let her take refuge in the local church,"She asked ""why are you taking me back?"" ",-0.063436076,-0.0055847066
2929,15852,1,1,Why do black people walk weird,They spent the first 9 months of their life dodging a coat hanger,0.46918997,-0.3369918
2930,27890,1,14,I hate when I'm hitting it from behind and the girl forgets my name...,...like seriously how many times do I need to tell her that my name isn't help.,-0.057525992,-0.9529174
2931,49306,1,1,Why can't orphans play baseball?,Its not like their parents were around to teach them,0.2612728,0.339667
2932,63358,1,587,Rumour has it Michael Jackson received 99% surface burns after a house fire.,"Well, what else do you expect when every part of you is plastic?",-0.59738827,-1.056156
2933,82737,1,5,What’s the difference between a Jew and my friend?,When you set them on fire they disappear.,-0.25429133,0.1058247
2934,73219,1,29,I named my dick the truth,Because these bitches can’t handle it,2.4082596,0.43225524
2935,34552,1,10,Kavanaugh's wife likes it in the butt,Hard to say no with a hand over your mouth ,-0.51204634,0.8504261
2936,85977,1,139,Whats similar between your mothers panties and a line of coke,id love to sniff them both,-1.8703151,1.2814407
2937,75136,1,0,Chadwick Boseman died,I guess Wakanda isn't forever,2.2436883,-0.43958595
2938,37264,1,1,Why was the down syndrome patient kicked out of the casino?,He was having too many 21's,0.56917274,-0.29800576
2939,48121,1,77,the victims in 9-11 ordered a pepperoni pizza,"they got PLANE, what a ripoff",-0.13169426,0.5085084
2940,51364,1,4,What worse than a barrel full of dead babies?,"The one I left alive at the bottom, trying to eat it’s way out.",-0.24507722,0.75853467
2941,29891,1,1,Yesterday I went down to the shop to get some black paint,But I couldn't because of the fucking moderator,-0.51197916,0.5968297
2942,50538,1,0,The reality is that we should all just unsub from this sub,No point in continuing to post/complain. You're just playing mods' game. They're probably masturbating on your complains.,1.0746434,0.4380815
2943,80622,1,0,This is how to piss of an autistic neighbour,Play music full bass aiming at his house,-2.2118044,1.3612944
2944,15578,1,0,What's the difference between a black guy and a pizza,About $5 and some change,-1.0289471,2.6463292
2945,79372,1,4796,What the difference between this sub and shit,Nothing no joke here just the truth,-2.9186988,2.9260113
2946,21302,1,20,Why did the foetus cross the road?,To get away from the wire coat hanger ,1.5915947,-0.4586058
2947,83943,1,69,How do Asians name their kids?,They drop a fork down the stairs and write down what they hear,-0.6087382,0.49948996
2948,72619,1,8,I don’t get why people talk about jews so much...,They’re always getting gassed up.,1.5491457,-0.34608424
2949,37824,1,12,How do you know that santa and your uncle are the same person?,The way their cock feels,-0.80460924,2.2072554
2950,77263,1,41,"How donated 10,000 for LGBTQ",We need to find a cure for that shit,-0.8868705,0.6812314
2951,65566,1,8,She told me she doesn’t have sex on first dates.,It’s a damn shame because she already drank the roofies.,1.3543565,-0.61419815
2952,63055,1,0,Kobe!,he said as he jumped out of the helicopter,-0.95001256,0.035267934
2953,28736,1,1,mall Santas are the best,they give you a free butt massage without even using their hands,-1.0859723,1.1864527
2954,25637,1,16,Instead of expecting your women to cook dinner for you like it's 1950,MAN UP and devolop a Meth habit so you don't have to eat. ,-0.78959846,-0.02869614
2955,22329,1,0,How do Muslims practice safe sex?,They mark the goat that kicks,0.5424919,0.8769565
2956,81510,1,4495,Why do LGBTQ members have the best drip?,Because they spent years in the closet.,0.18702687,-0.15748563
2957,51132,1,1,What’s the difference between darkjokes mods and dankmemes mods?,Darjokes mods are actually fucking gay,-0.13003221,1.4960908
2958,65749,1,88,I heard two people on the twin towers ordered two pepperonis..,They got two plains instead...,0.018556463,1.1193718
2959,54139,1,2842,What do you tell a woman with two black eyes?,Nothing. You already told her twice :|,-0.16819122,-0.3563899
2960,48346,1,18,Nobody dies a virgin..,Even Jesus got nailed before he died.,-0.13538654,-0.09105367
2961,8653,1,21,why don't jewish men eat pussy?,because it's too close to the gas chamber,-1.1269311,0.60697293
2962,31337,1,0,"A white guy, a Jewish guy, and a negro walk into a bar...","I can speak Spanish mudafuker, can't silence me!",-1.5018678,0.744366
2963,10277,1,8,Why are comedians from Houston so funny?,Their jokes are never dry.,1.4285798,1.4582114
2964,77820,1,13,Hello my name is Dan,I got a gun get in the van,-1.6642597,1.1313279
2965,76464,1,6,When my girlfriend saw my cock for the first time she laughed.,But I suppose all ten year olds are immature.,1.470219,0.12095892
2966,56882,1,0,What's the difference between a baby and an onion.,I wouldn't fuck an onion.,1.000653,-1.6780124
2967,82163,1,11,I saw 2 blind guys fighting in a street,"You wont believe how fast they ran when I yelled ""My money is on the one with the knife!""",-0.63780177,0.57858723
2968,54193,1,33,Whats similar between a bike and black people,They're both locked up in my basement,-0.7957354,1.1075275
2969,32985,1,29,I can’t tell why my daughter’s bleeding...,Is it her period or did I break her hymen this time?,0.64116335,-0.6667382
2970,19952,1,0,So i was playing cards against humanity...,"The black card was ""_______is a slippery slope that leads to ______"" and i played ""the jews"" and ""being on fire""",-1.3412687,1.5008607
2971,25813,1,14,Jokes are like people,The darks ones are hated on and the older ones are stolen from,-1.3116406,1.9480257
2972,52909,1,3,I accidentally called out my mums name during sex,and my sister hasn't talked to me since.,1.0537251,-1.1896298
2973,12614,1,327,People believe childrens day is celebrated 9months after valentines,Its actually people waiting 3 months before the day of love,-1.7399591,1.0099252
2974,75022,1,6,So Chadwick Boseman of Black Panther died today.,Rumor has it he’ll be killed off screen by a cop before the Black Panther.,-0.053510036,-0.7760446
2975,45149,1,12,I had seen an openly gay Muslim in Iraq the otherday,I also saw him in the news I recognized him with the bodies,-0.7637805,1.275035
2976,66480,1,4,why didn't the cannibal want to eat the clown?,because it would ruin the birthday party.,-0.7170835,-0.18761906
2977,68621,1,11,A Muslim enters a cafe.,He gets shot because he's a Shiite in a predominantly Sunnite country.,0.896458,-1.146484
2978,78005,1,232,I want to go up to a depressed person grab and slap their wrists and say,I like your cut g,-0.688478,0.59960216
2979,34471,1,11,One of my friends got mad at me today,"He told me he wants to start a YouTube channel, and I told him that I hope one of his videos will blow up.",-0.37164488,-0.7123454
2980,51142,1,1,This sub has devolved into utter shit,"Heck the bad mods, unlock if gay",-1.5614946,2.0144987
2981,58710,1,18,Why are birds the better pet,When a bird dies you can eat it,0.29020286,0.124136716
2982,18314,1,0,What's the difference between a nigger and a snow tire?,A snow tire doesn't sing when you put chains on it.,0.85454303,-2.1433456
2983,41428,1,1,Why was the 2 year old black kid pissed?,He was going through a midlife crisis. ,0.7614903,0.04366932
2984,54730,1,33,Yesterday I called pest control,Apparently muslims were not on their catalogue,0.04714104,0.634117
2985,67825,1,1,"Social distancing and the need to be 6ft or 2 metres away from me, I came to realize...",I finally know what it’s like to be a black person.,0.14515203,-0.91389537
2986,52468,1,36,Why has Mexico never won the Olympics,"Cause anyone who could run, jump, or swim has already left.",-1.624813,0.5510957
2987,83004,1,53,How do you know Allah is the only god?,Why else did the universe start with a big explosion?,-0.06469068,-0.74003834
2988,31659,1,328,What’s black and sits at the top of the stairs,Stephen Hawkins after a house fire ,-1.2760799,2.3054585
2989,85078,1,32,The great thing about fucking twenty nice year olds,Is that there are 20 of em,-0.5846913,-1.0096468
2990,70641,1,0,I'm a chubby chaser,"Seriously, I don't know why this fat cunt runs so fast. He needs to slow down so I can kill him already!",-0.22077297,-0.49504277
2991,82933,1,52,What do Michael Jackson and a ps4 have in common?,children both turn them on.,-1.5106037,1.0580305
2992,12722,1,2,How can i choose between shooting up heroin or a school?,How white I wanna be,-0.85524714,-0.8616962
2993,78098,1,29,How do you tell the difference between a midget and a toddler?,Midgets can articulate the fun they're having while you're fucking them.,1.2247823,-0.7077464
2994,23033,1,16,This new dating app is amazing!,Roblox is a weird name for it though.,-0.46914113,-0.27689317
2995,84284,1,45,"I asked 100 women,""what is your favorite shampoo?""","99 of them said ""get the f×ck out of my bathroom"". and one said ""Hary stop im going to tell your father"".",-0.047270164,-0.03233956
2996,27731,1,5,What's the hardest part about having a newborn with a hydrocephalus?,It will take some lube to masturbate your ass with his head.,0.97354203,-0.56329197
2997,30343,1,4,"Rose are red, Violets are twisted,",Bend over Auto mod you’re about to get fisted,-0.6226008,1.3248019
2998,48043,1,5,What is different about a mine and a Muslim?,Mines only explode when there stepped on.,0.38013136,-0.6798064
2999,51947,1,17,Why do black people taste nice?,Because they have all got chips on their shoulders,-0.25131622,0.15705496
3000,36364,1,19,Stop making rapist jokes,"It hits me on the inside, and besides I already served my sentence ",-0.35199523,-0.4093021
3001,11181,1,12,How do you cut a Redneck's dick off?,Kick his sister in the jaw.,0.40484217,-1.5064375
3002,64270,1,33,Imagine chilling in the World Trade Center,Then you connect to the Airplane's wifi,-0.38526756,2.5592592
3003,32970,1,1,Why is 6 afraid of 7?,Because 7 is friends with the stupid automod on this sub. CAN WE PLEASE REMOVE THE AUTOMOD!,0.6678407,-0.3288217
3004,67799,1,1,Did you hear about the dyslexic klansman?,He went around lynching gingers.,3.0029833,-0.1645669
3005,56692,1,2,Why does somebody always lock these posts?,Because they want to go straight to hell.,-0.45541376,-0.10812951
3006,21184,1,70,What’s the difference between Santa and a Jew?,Santa goes down the chimney.,0.9997108,-1.7656591
3007,72691,1,1,What is the similarity between your wife and a muslim guy?,They get the blowjob done right.,0.013411535,-0.22055821
3008,12430,1,74,"Woman claim ""women's rights""","Misogynists fire back, ""Abouts whats?""",0.773067,0.6413285
3009,36489,1,0,Oh shit got another girl pregnant.,I swear to god these bitches think I'm made of coathangers ,1.8146526,-0.7736929
3010,12787,1,268,Why is there cotton at the bottom of drug bottles?,To remind black people that they were cotton pickers before drug dealers.,0.42278183,-0.40594786
3011,68270,1,91,The fat acceptance movement...,Is the only movement without movement,-0.44234598,2.1189692
3012,70460,1,99,"Hey girl, are you George Floyd?",Cause I’m gonna have you begging for air when I’m done with you,0.923254,-0.6808682
3013,12313,1,9,What’s the difference between a 10 pound puppy and a 10 pound dumbbell?,The dumbbell will break your toes when you punt it off a cliff.,-0.10551681,-0.43708652
3014,43102,1,36,my dad is trying a new weight loss program,its German so you know it will work,-1.3838642,0.22157957
3015,71768,1,0,Why was the paraplegic man shot,The police saw that he was unarmed,-1.034079,1.0902361
3016,59737,1,1,Why is coffe black?,Because it steals the sleepiness from you.,0.11950069,-0.14883654
3017,21837,1,3,What is the most successful pickup line?,"""Does this smell like chloroform to you"".",2.0862415,-1.2197043
3018,59448,1,11,Whats the difference between sand in a truck and kids in a truck?,You cant take out sand with a garden fork,-0.20677775,-0.18631952
3019,31019,1,2,What’s the difference between r/jokes and r/darkjokes ?,The mods aren’t racist in r/jokes,1.6823022,-1.8340281
3020,63043,1,100,What do a pregnant teenager and her baby have in common?,They both think “Mom’s gonna kill me.”,2.6044405,-0.08790088
3021,20193,1,1,You know what I hate most about eating pussy??,Putting the diaper back on afterwards...,-0.5892438,-0.78584594
3022,33841,1,20,How do u fit 1000000 jews in a car?,"2 in front,3 in the back and the rest in the ashtray",-1.4216716,-0.887466
3023,60518,1,18,Why did the three year old antivax kid have depression,He was having a midlife crisis.,0.8520068,0.26871723
3024,45041,1,3,What's the difference between a dead nigger and a Cadillac?,I don't have a cadillac in my garage.,1.2023835,-1.4850368
3025,34387,1,27,Weather in the South is like a 16 year old Britney Spears,Really hot and kinda gross.,-2.8258224,1.6436572
3026,75545,1,7,What's the similarity between womens shoes and jews?,There are more in 38 than 45,-0.5054418,0.28919905
3027,31692,1,66,What's the difference between my mom and my home,"My dad came in my mom, but never came back home",-0.82407916,-0.4052955
3028,59356,1,14,What’s the difference between newcool and Hong Kong?,Nothing! Both parties don’t want you have your own opinion or will to act out! Have fun reading this ya fucking commie,0.2748344,0.49275783
3029,69184,1,13,This whole virus situation really caught me by storm.,"just like my uncle, I never saw it coming....",-0.762224,0.55645466
3030,36673,1,59,I nailed the boss's daughter,"Can't get fired, I'm self employed",-0.71842885,1.2923367
3031,57273,1,56,A Jewish girl once asked me for my number,"I told her we use names here, not numbers",-1.0396409,-0.45182297
3032,8729,1,1,I'm sick and tired of Mexicans naming their children Jesus.,"Jesus wasn't Mexican, he was a human. ",0.24123576,-0.8501502
3033,14487,1,144,If a feminist boycotts.....,Doesn’t it defeat the purpose?,3.121102,-1.7178776
3034,64238,1,28,What did an Arab guy tell his American girlfriend during sex?,I’ll do you like i did 9/11.,0.3040611,-0.41724986
3035,83183,1,49,I was caught making love to four cheerleaders in the locker room.,The school shooter said he'd let me live if I stopped defiling his corpses.,1.237489,0.042959753
3036,35955,1,8,Its not easy being German,Every time you want to make pizza you have to scrape the oven out of human remains,-0.85904235,-0.2017792
3037,81705,1,62,I was supposed to take my sister to her therapist for the trauma she suffers even since she was raped,Well guess I’m gonna be a father now,0.43847048,-0.03684227
3038,50952,1,3,­­­­­­­­­­­,Try and lock this bitches!,-0.048445377,1.1750332
3039,80540,1,20,What does gamers and jews in the 1940s have in common,They both dont want to go in the shower,-0.7532585,1.0475333
3040,50454,1,2,What do black people and this post have in common.,It’s gonna get locked up.,1.4828497,-0.7486559
3041,44208,1,29,Amy Schumer should be able to say the n-word,"Sure she isn't black, but she steals like one.",0.2795719,-0.1127583
3042,47763,1,25,How can you tell blacks are lazy as fuck,They are known for wearing undershirts,1.8777126,-0.6020656
3043,15878,1,1,A black man and Muslim jump off a building. Who lands first?,Not the Muslim - he has a plane to crash.,-0.64968735,0.06139888
